Time Data,Headline
2024-11-03T22:31:54Z,Cab someone identify these phones my dad found on the nyc subway tracks 
2024-11-03T22:29:46Z,Is there a way to just see the wallpaper on android phones? I mean a screen without apps on samsung s24 ultra ? Or hide it temporarily or customising time Thanx 
2024-11-03T22:24:33Z,Whatsapp always running in background even its in deep sleep
2024-11-03T22:09:54Z,65Qn90c panel warp
2024-11-03T21:50:20Z,Is the Samsung Galaxy Tab S9 FE good for work meetings?
2024-11-03T21:49:46Z,Samsung Galaxy S24 Ultra Settings for Instagram
2024-11-03T21:39:58Z,Can someone identify all these phones they got found on the nyc subway tracks by my dad who works there 
2024-11-03T21:36:18Z,Samsung Galaxy S24 FE (Pro Mode)
2024-11-03T21:35:40Z,Its unbelievable how much does the signal of your celular data consume your battery 
2024-11-03T21:25:58Z,S22 - Emergency Calls Only
2024-11-03T21:05:00Z,Dictation in capital letters
2024-11-03T21:01:03Z,3 months after getting approved for samsung members rewards... Still nothing
2024-11-03T20:30:53Z,"First time buying phone online, what do I look for when buying phones not available in US"
2024-11-03T20:18:43Z,At my wits end with PC HDMI on my s90c - Looking for any suggestions
2024-11-03T20:18:04Z,Finding a phone case for A24 5G
2024-11-03T20:18:04Z,Finding a phone case for A24 5G
2024-11-03T20:15:00Z,Switch to Samsung from pixel? Headed to India. 
2024-11-03T20:11:40Z,"After 3 years, I was struck by the S20+ screen curse. Replacement service is expensive (&gt;250€). Aliexpress has new screens for 60€. Use the service, repair myself, or buy a new phone? (prices for France)"
2024-11-03T20:07:57Z,Smart Calibration is not avaible on my g7 monitor
2024-11-03T20:07:57Z,Smart Calibration is not avaible on my g7 monitor
2024-11-03T19:26:31Z,"Samsung A13, essentially bricked."
2024-11-03T18:56:56Z,S24 FE - 600€ Good or Bad?
2024-11-03T18:56:54Z,"Reminder to change to standard time today, and how bad SmartThings is."
2024-11-03T18:53:33Z,Samsung shop app and website bit working?
2024-11-03T18:32:28Z,S24FE does not support rcs acc to messages
2024-11-03T18:28:52Z,Lost my buds pro 3 charger and can't find a replacement online?
2024-11-03T17:55:13Z,multitouch problem A55
2024-11-03T17:55:13Z,multitouch problem A55
2024-11-03T17:51:24Z,multitouch problem
2024-11-03T17:51:24Z,multitouch problem
2024-11-03T17:50:54Z,S23 ultra or S24 ultra? 
2024-11-03T17:48:49Z,problem with multitouch A55
2024-11-03T17:48:35Z,8 GB vs 12 GB RAM for Samsung A55?
2024-11-03T17:34:23Z,samsung software issues after update
2024-11-03T17:32:30Z,samsung software issue update ui 5.1
2024-11-03T17:31:27Z,Samsung software issue update ui 5.1
2024-11-03T17:26:46Z,Magnets with S pen: am I killing my screen?
2024-11-03T17:14:10Z,Good lock sharing 
2024-11-03T16:53:55Z,A35 orA54
2024-11-03T16:37:01Z,What phone to chose?
2024-11-03T16:37:01Z,What phone to chose?
2024-11-03T16:13:59Z,Where can I see the time I have the phone?
2024-11-03T15:59:19Z,S pen pro on the tab s 9 fe +
2024-11-03T15:19:57Z,Desbloqueio padrao PIN do Samsung Galaxy A30s sem hard reset?
2024-11-03T15:12:47Z,Samsung Refrigerator
2024-11-03T15:01:29Z,Alarm not working specifically 8-9AM 
2024-11-03T15:01:29Z,Alarm not working specifically 8-9AM 
2024-11-03T14:31:18Z,S24 or S25? 
2024-11-03T13:58:25Z,My negative history with Samsung phones
2024-11-03T13:52:45Z,"TV suggestions? - Uses, price vs quality, etc. "
2024-11-03T13:52:45Z,"TV suggestions? - Uses, price vs quality, etc. "
2024-11-03T13:35:45Z,S24 Ultra/S25 Ultra?
2024-11-03T12:36:13Z,Screenshot Edge Panel
2024-11-03T12:35:00Z,Does anyone have the exynos chip for 2+ years now?
2024-11-03T12:18:33Z,Samsung phone has been deactivating itself randomly
2024-11-03T11:03:51Z,Issue with samsung
2024-11-03T11:01:22Z,"Daily Support Thread | November 03, 2024"
2024-11-03T10:51:14Z,Am I crazy?
2024-11-03T10:07:45Z,"Replaced my S22 with new S23 yesterday, what a change!"
2024-11-03T09:26:45Z,Samsung A71 or Samsung A55 
2024-11-03T08:14:32Z,Google find my device will be interoperable with smarttag trackers?
2024-11-03T08:09:38Z,No Khmer language option?
2024-11-03T08:02:58Z,Found this gem
2024-11-03T07:45:41Z,random concern about s24fe. might be nothing
2024-11-03T07:26:18Z,Samsung Tv ambient mode
2024-11-03T07:00:13Z,Why the number is censored? 
2024-11-03T06:44:40Z,"Doesn't Samsung phones have ""remove gesture hint"" option in one UI 6.1?"
2024-11-03T06:35:00Z,Can the CSC of a TDRA variant phone be changed to India? 
2024-11-03T06:08:38Z,"forgot samsung a12 pin, is it possible to brute force"
2024-11-03T06:08:24Z,Please help me with my tablet
2024-11-03T05:47:35Z,Switching from iPhone
2024-11-03T05:40:51Z,Samsung for small content creators?
2024-11-03T05:34:11Z,I hate my Smart TV
2024-11-03T05:25:34Z,Now Theft Protection is Avaliable on Galaxy A Series!!!
2024-11-03T04:57:44Z,Why this message keep appearing? 
2024-11-03T04:37:58Z,Secure folder
2024-11-03T03:52:17Z,"I named my Assistant coco and gladly she remembered it. She is also smarter than any AI I've ever had ( siri, Cai ect ) "
2024-11-03T03:52:17Z,"I named my Assistant coco and gladly she remembered it. She is also smarter than any AI I've ever had ( siri, Cai ect ) "
2024-11-03T03:46:47Z,"I tried to make One UI 7 icons better, what do you think about this?"
2024-11-03T03:42:57Z,8 Random people from south Dakota somehow joined a call?
2024-11-03T03:42:13Z,Samsung killing it with updates 
2024-11-03T03:38:07Z,Help with looking for a case
2024-11-03T03:10:08Z,Galaxy A15 or Galaxy S24? 
2024-11-03T03:08:31Z,What Wireless Charging is recommended for Galaxy Note 9 that is under 18 Dollars and has fast charge if possible. 
2024-11-03T01:47:24Z,Can you change/use a different autocorrect for Samsung keyboard?
2024-11-03T01:37:06Z,"Dust plugs, worth it or potentially port damage?"
2024-11-03T01:36:08Z,Samsung K zoom macro mode question
2024-11-03T01:23:46Z,Refurbished Galaxy Note 20 or S21?
2024-11-03T01:22:39Z,"""Background flicker"" or ""as if the frame rate drops"" when footage contains many contrast rich details and slow camera pans - Smart TV 55"" QLED 4K 55Q65D 2024 - view the provided short clip"
2024-11-03T01:07:18Z,Tab s10 ultra price black friday 
2024-11-03T01:01:36Z,Is there S24 Plus in India Region?
2024-11-03T00:46:05Z,As one who dual carried iphones and Galaxies
2024-11-03T00:43:59Z,How intrusive are Samsung apps?
2024-11-03T00:31:55Z,S22 with airpod maxs?
2024-11-10T23:51:59Z,"Why people's fetish for ""soft animations""? "
2024-11-10T23:49:56Z,"What is the face of people for ""soft animations""? "
2024-11-10T23:49:56Z,"What is the face of people for ""soft animations""? "
2024-11-10T23:08:24Z,Question about Samsung Galaxy watch
2024-11-10T23:08:24Z,Question about Samsung Galaxy watch
2024-11-10T22:58:09Z,I lost the media output button
2024-11-10T22:43:44Z,Advice for PUK locked 23 Ultra
2024-11-10T22:41:42Z,Remote device control Galaxy S23 Ultra / Android
2024-11-10T22:15:28Z,Keyboard refresh rate
2024-11-10T21:59:44Z,"""double the storage on us"""
2024-11-10T21:59:24Z,Do I need to install Gemini?
2024-11-10T21:59:24Z,Do I need to install Gemini?
2024-11-10T21:39:31Z,Planning on buying a Galaxy S24. Should I wait for black frinday or cyber monday? Where should I buy it?
2024-11-10T20:54:23Z,What can you do on the app when you got banned from the Samsung Members Communily like mine?
2024-11-10T20:50:05Z,Samsung Galaxy TAB tablet cannot connect HDMI to TV
2024-11-10T20:43:04Z,unusual viewing angles on s22 ultra
2024-11-10T20:36:12Z,What Caused the Galaxy Z Fold Hinge not to fully open.
2024-11-10T20:33:45Z,My phone kept vibrating randomly for no reason (no notifications as well)
2024-11-10T20:26:56Z,Will a 25w charger charge an A35 phone faster than an Oppo 80w charger?
2024-11-10T20:26:56Z,Will a 25w charger charge an A35 phone faster than an Oppo 80w charger?
2024-11-10T20:23:06Z,What does this mean?
2024-11-10T20:18:56Z,"Can you do negative colours? The ""color inversion"" toggle seems broken to me"
2024-11-10T20:13:07Z,Whats better google messages or samsung messages 
2024-11-10T20:06:43Z,"Found an unknown app ""iauditor"" on my phone, what is it for?"
2024-11-10T19:58:03Z,Watch 7 + Ring?
2024-11-10T19:54:56Z,Is Finance the best for samsung?
2024-11-10T19:51:26Z,"Dear samsung, where is the sdslot and headphone jack?"
2024-11-10T19:32:34Z,"""Offers"" program (military) not working for Q990C"
2024-11-10T19:27:19Z,How do you flash a global rom on a chinese phone?
2024-11-10T18:41:44Z,Major L for accessibility. 
2024-11-10T18:37:57Z,Wanting to switch to pixel
2024-11-10T18:10:54Z,problem with samsung a715F
2024-11-10T17:49:17Z,16gb vs 12gb 
2024-11-10T17:49:17Z,16gb vs 12gb 
2024-11-10T17:38:37Z,Why Is Solitaire Cash On The Galaxy Store But Not On The Play Store?
2024-11-10T17:31:24Z,Thoughts on privacy screen protectors in relation to A35?
2024-11-10T17:25:52Z,samsung appaling service
2024-11-10T17:22:06Z,Cannot find manual power button on Frame TV
2024-11-10T17:08:35Z,I still keep the original S6 box! The phone itself had been stolen long time ago tho.
2024-11-10T17:08:35Z,I still keep the original S6 box! The phone itself had been stolen long time ago tho.
2024-11-10T16:39:56Z,Button for drawing disappeared on Samsung a9 tablet.
2024-11-10T16:36:16Z,What to switch to from s10e?
2024-11-10T16:22:19Z,Buy a refurbished S23+ now or wait for S24 Ultra to go on sale? 
2024-11-10T16:22:19Z,Buy a refurbished S23+ now or wait for S24 Ultra to go on sale? 
2024-11-10T15:57:48Z,Recommendations needed
2024-11-10T15:50:45Z,I've already bought this icon setup why is it making me do it again after resetting my phone
2024-11-10T15:48:08Z,Should I switch?
2024-11-10T15:43:43Z,Should I switch from Pixel 7 To S23 FE?
2024-11-10T15:15:51Z,Online order not going through
2024-11-10T15:11:28Z,New Features
2024-11-10T15:08:25Z,My S24+ had and update overnight and now fingerprint and eye scan sensor dont work
2024-11-10T15:01:45Z,Samsung Music AI? 
2024-11-10T14:46:43Z,Adaptive Brightness 
2024-11-10T14:21:26Z,"If you have Z Flip / Fold 6, please read body text:"
2024-11-10T14:14:39Z,Straight up whats the best samsung phone?
2024-11-10T13:25:00Z,Samsung G7 Odyssey Doubts
2024-11-10T13:25:00Z,Samsung G7 Odyssey Doubts
2024-11-10T12:49:36Z,Fix annoying screen
2024-11-10T12:37:44Z,New screenshot tool
2024-11-10T12:26:10Z,"How to delete ""Other Files"" tab"
2024-11-10T12:13:34Z,Damaged Device Trade In - Do you think Samsung will accept my phone?
2024-11-10T11:50:49Z,Samsung Galaxy A53 won't boot into recovery mode.
2024-11-10T11:35:56Z,"Suggestions for One UI 7.0 - Please, Samsung, consider these improvements. "
2024-11-10T11:34:11Z,"Suggestions for One UI 7.0 - Please, Samsung, consider these improvements. "
2024-11-10T11:33:27Z,Transparent status bar
2024-11-10T11:32:50Z,Samsung z flip 6 overheating
2024-11-10T11:15:27Z,Should i upgrade?
2024-11-10T11:13:16Z,Do Samsung A02s no longer get updates?
2024-11-10T11:11:40Z,Rewards Points upgrade to platinum
2024-11-10T11:01:19Z,"Daily Support Thread | November 10, 2024"
2024-11-10T10:48:46Z,Moved over from Chrome to Samsung Internet 
2024-11-10T10:21:43Z,S95C Gamma Setting BT.1886
2024-11-10T10:21:43Z,S95C Gamma Setting BT.1886
2024-11-10T10:18:15Z,Is it just me or are any other S23 users facing battery drain issues?
2024-11-10T10:17:37Z,Changing from Xiaomi to Samsung 
2024-11-10T09:23:46Z,I recently bought the A35 and I am using my previous phones 80w charger and the charging is pretty slow. Why is this happening?
2024-11-10T09:23:46Z,I recently bought the A35 and I am using my previous phones 80w charger and the charging is pretty slow. Why is this happening?
2024-11-10T09:20:22Z,Samsung odyssey neo g7 32' not loading games 
2024-11-10T09:14:59Z,Save $100 when you trade-in your smartwatch or smart ring for Galaxy Ring (US only)
2024-11-10T07:42:54Z,"All I see is ""8k isn't relative, there are better 4k panels"""
2024-11-10T07:42:54Z,"All I see is ""8k isn't relative, there are better 4k panels"""
2024-11-10T07:36:31Z,Best video for AMOLED screen 
2024-11-10T07:36:31Z,Best video for AMOLED screen 
2024-11-10T07:35:03Z,Samsung Galaxy S25 Ultra and S25+ Benchmark Leak: Key Performance Insights
2024-11-10T07:34:16Z,"My 4-year-old Huawei is on the way out, so I'm thinking of replacing it with a Galaxy A55 "
2024-11-10T07:34:16Z,"My 4-year-old Huawei is on the way out, so I'm thinking of replacing it with a Galaxy A55 "
2024-11-10T07:26:28Z,Are there any good bumper/frame style cases for the base S23?
2024-11-10T07:25:35Z,Galaxy S23 FE + Galaxy Buds 3 Pro
2024-11-10T07:04:56Z,Drastically Low battery backup on s23 ultra.
2024-11-10T06:35:55Z,I got myself a S21 FE recently and wanted to ask if you know a company that makes good cases for them? 
2024-11-10T05:40:46Z,Should I take the flip 4?
2024-11-10T05:25:43Z,Unlock samsung s9help
2024-11-10T05:21:04Z,Was this a good deal on the D990C?
2024-11-10T05:05:48Z,samsung a35
2024-11-10T05:03:26Z,Can I still trade in my phone with Samsung if...
2024-11-10T05:03:26Z,Can I still trade in my phone with Samsung if...
2024-11-10T04:59:10Z,so i have a samsung a13 with 128gb i've continually playing with this phone for a long time like since 2022 how many years till i have on this 
2024-11-10T04:55:58Z,Amazing deal for the Fold 6 through Samsung
2024-11-10T04:55:58Z,Amazing deal for the Fold 6 through Samsung
2024-11-10T04:49:55Z,samsung g5 problem 
2024-11-17T23:42:53Z,I failed to find a suitable replacement for the 2019 S10e
2024-11-17T23:25:14Z,Any ideas?
2024-11-17T23:21:23Z,Does Samsung typically provide deals for Black Friday/Cyber Monday
2024-11-17T22:59:44Z,S-pen replacement nib for S9FE
2024-11-17T22:57:56Z,Renewed S23 from Walmart
2024-11-17T22:54:37Z,Using a S24+ from Canada in Europe
2024-11-17T22:30:43Z,Anyone know what this icon is?
2024-11-17T22:29:19Z,Is the A55 worth it?
2024-11-17T22:01:28Z,"Need help, texts won't send"
2024-11-17T21:44:33Z,The S21 is just suffering
2024-11-17T21:44:33Z,The S21 is just suffering
2024-11-17T21:35:35Z,Honest Review on Samsung Galaxy A15 5G
2024-11-17T21:35:35Z,Honest Review on Samsung Galaxy A15 5G
2024-11-17T21:05:14Z,Recently lost the case for my Galaxy Buds2.
2024-11-17T20:53:33Z,Background activity that doesn't stop 
2024-11-17T20:32:07Z,"Guys. I've got some money to spend on a new phone, but I've got a dilemma."
2024-11-17T20:24:34Z,Ice machine stopped making ice 
2024-11-17T20:12:56Z,DU7200 and Samsung Soundbar connectivity 
2024-11-17T19:52:55Z,How do you backup your photos before a factory reset?
2024-11-17T19:49:56Z,20% fee to return S24U because I logged in on the device?
2024-11-17T18:38:49Z,A35 or M35? Does the battery makes a big difference?
2024-11-17T18:24:37Z,How do you put stickers on your Samsung keyboard short cut like this?
2024-11-17T18:22:54Z,Como activo eleccion sobre publicidad en los ajustes de la galaxy store?
2024-11-17T18:20:47Z,My Samsung tv bu8000 screen is showing black spot.
2024-11-17T18:20:47Z,Online Update 
2024-11-17T18:15:15Z,All Lenses on Prism (ALoP)
2024-11-17T18:08:43Z,Galaxy AI is really poor!
2024-11-17T18:07:14Z,Samsung A35 haptics &amp; animations 
2024-11-17T18:07:14Z,Samsung A35 haptics &amp; animations 
2024-11-17T18:03:16Z,Samsung Refrigerator Family Hub Total Loss after 5.5 Years
2024-11-17T18:00:52Z,Don't Ever Buy a Samsung Refrigerator - Total loss after only 5.5 years!
2024-11-17T17:47:46Z,Samsung Fridge RF267AEPN is switching from cubed to crushed to water over and over again.
2024-11-17T17:28:34Z,What should I do with my phone?
2024-11-17T17:26:35Z,My s26 ultra concept design 
2024-11-17T17:26:35Z,My s26 ultra concept design 
2024-11-17T16:55:03Z,Is it worth swapping the Galaxy Buds 1 Pro for the Buds 3? 
2024-11-17T16:49:56Z,Does Samsung Q60D TVs come with wall brackets in the box?
2024-11-17T16:39:03Z,S24 Promotions
2024-11-17T16:26:11Z,Smg Z Fold 3 o Flip Z 5
2024-11-17T16:14:42Z,Is this A55 5G from Amazon valid for the free Fit 3 Watch promotion?
2024-11-17T15:54:25Z,Samsung Galaxy S25 Ultra: What Do We Know About It So Far?
2024-11-17T15:41:27Z,Smart Tag 2 (pet care)
2024-11-17T15:38:34Z,Is Samsung Direct that bad?
2024-11-17T15:32:26Z,S24 battery life.
2024-11-17T15:17:20Z,Water or Foreign material alert
2024-11-17T15:14:38Z,Water or Foreign material alert
2024-11-17T14:45:46Z,how long this stupid gnat design will last? 
2024-11-17T14:42:21Z,Bright ring around s24fe camera punch hole
2024-11-17T14:34:42Z,Unbox your Samsung Galaxy A55 and dive into a world of features!
2024-11-17T14:31:07Z,The Samsung Freestyle is a game-changer in portable projectors.
2024-11-17T14:30:35Z,The Samsung Freestyle is a game-changer in portable projectors.
2024-11-17T13:50:29Z,Samsung soundbar cutting in and out 
2024-11-17T13:43:32Z,Samsung SP-LPU9D switch connections quickly 
2024-11-17T13:29:46Z,"Samsung TV sound not working, help!"
2024-11-17T13:28:14Z,Cracked screen and deciding next steps. Note 10+ &gt; Note 20 U &gt; S25 U. Or Note 10 &gt; S25 U.
2024-11-17T13:26:55Z,Order supposed to be delivered next day but is delayed
2024-11-17T12:40:21Z,Fair asking price?
2024-11-17T12:35:42Z,Watch4 faulty display
2024-11-17T12:24:44Z,S23 ultra users how often do you use 200MP?
2024-11-17T12:08:34Z,Are the foldables worth it? Are they better than the normal phones?
2024-11-17T11:32:17Z,Dust in a35 camera
2024-11-17T11:01:24Z,"Daily Support Thread | November 17, 2024"
2024-11-17T10:28:55Z,Anyone here got their Buds FE working as a microphone when connected to their Desktop/PC ?
2024-11-17T10:27:20Z,"Samsung A12, Possible to Upgrade to Latest Android Version?"
2024-11-17T10:14:04Z,Samsung Oven Advertised Features Missing - Advice Needed
2024-11-17T09:29:48Z,Usage Statistics in 2024
2024-11-17T09:15:03Z,Samsungs Buds 3P Charging Defect?
2024-11-17T09:04:32Z,Recommendation for a new phone
2024-11-17T09:01:33Z,which games can i run on my devices?
2024-11-17T08:25:01Z,Is there a samsung phone in mid range which does not have heating issues?
2024-11-17T07:33:03Z,"I got this Samsung from a friend even tho I’m an iPhone person, what 1 is it?"
2024-11-17T07:33:03Z,"I got this Samsung from a friend even tho I’m an iPhone person, what 1 is it?"
2024-11-17T07:24:10Z,Will the original dates be kept when transferring pictures from laptop to s24 with USB cable? Unsure about switching to s24 
2024-11-17T07:18:15Z,Will the original dates be kept when transferring pictures from laptop to s24 with USB cable? Unsure about switching to s24
2024-11-17T07:18:15Z,Will the original dates be kept when transferring pictures from laptop to s24 with USB cable? Unsure about switching to s24
2024-11-17T07:05:08Z,S23 to S24 Ultra 
2024-11-17T07:04:13Z,Apps not showing as full
2024-11-17T05:41:15Z,Thinking about switching to Samsung
2024-11-17T05:29:56Z,Can I use USB TYPE C output from my Mac Mini and connect to Tab S9Fe as a monitor? 
2024-11-17T05:09:58Z,Best S24+ Price?
2024-11-17T04:59:27Z,120hz display option broken?
2024-11-17T04:53:24Z,GS80D OLED 4k 240hz Monitor
2024-11-17T04:36:19Z,Samsung wallet 
2024-11-17T04:35:05Z,Losing cell service
2024-11-17T04:30:40Z,Samsung QLED Q72DD Light Banding
2024-11-17T04:19:23Z,Multi-sound
2024-11-17T04:14:53Z,Why doesn't Samsung copy features from other interfaces? 
2024-11-17T03:29:35Z,Q700C vs QS730D soundbars
2024-11-17T03:11:49Z,Motherboard Failure... Is That It?
2024-11-17T03:01:49Z,Replace battery or not?
2024-11-17T02:52:37Z,Battery replacement or not?
2024-11-17T02:29:20Z,Samsung Galaxy S24 FE for $475 - take it now or wait for Black Friday?
2024-11-17T01:49:07Z,"Samsung Messages ""Sending as John Doe"""
2024-11-17T01:35:20Z,Beware! There are Amazon sellers selling counterfeit products!
2024-11-17T00:46:57Z,I'm trying to find the thinnest and best quality case for the S24U. What brand do you recommend? No Pitaka - those are already very expensive. Thank you!
2024-11-16T23:55:33Z,Samsung phone displaying weird display..
2024-11-16T23:27:20Z,Should I trade in my fold 6 when the samsung s25 comes in I'm afraid fold 6 inner screen going mess up only had it for months though watching the s25 kinda like it but like my fold 6 inner screen wht would yall do 
2024-11-16T23:27:20Z,Should I trade in my fold 6 when the samsung s25 comes in I'm afraid fold 6 inner screen going mess up only had it for months though watching the s25 kinda like it but like my fold 6 inner screen wht would yall do 
2024-11-16T23:18:33Z,Samsung HW-Q990D subwoofer constantly dropping
2024-11-16T23:09:14Z,Well I found it at School Storage
2024-11-24T23:34:29Z,bought the galaxy a25 5g but there's no gorilla glass
2024-11-24T23:22:32Z,Need help choosing one of these phones
2024-11-24T23:13:11Z,S20 FE 5G REPAIR ADVICE
2024-11-24T23:10:18Z,Where's the 1TB Fold 6 ??
2024-11-24T23:07:35Z,Joining the family
2024-11-24T23:05:11Z,"New Update, the lockscreen time?"
2024-11-24T23:05:11Z,"New Update, the lockscreen time?"
2024-11-24T23:03:38Z,"First Galaxy Phone - Saving Money Reminders: Referrals, Cheaper Color Options, Cashback using Paypal with Honey Extension, and Profession-related ID.me Discounts"
2024-11-24T22:41:41Z,Samsung OLED Odyssey G60SD
2024-11-24T21:34:51Z,Are you using case or phone cover
2024-11-24T21:30:01Z,Switching from iPhone 
2024-11-24T21:29:12Z,No 6E on my Galaxy S24
2024-11-24T21:27:31Z,Custom Keyboards with stickers
2024-11-24T21:11:08Z,S25u vs S24u bottom design.
2024-11-24T21:11:08Z,S25u vs S24u bottom design.
2024-11-24T20:49:06Z,My mom is deciding on a new phone
2024-11-24T20:31:54Z,Galaxy Buds FE fit compared to Galaxy Buds+
2024-11-24T20:20:49Z,Galaxy store not here
2024-11-24T20:20:49Z,Galaxy store not here
2024-11-24T20:09:54Z,Samsung Watch 7 and Freedom Network
2024-11-24T20:09:16Z,Question about my next phone ga
2024-11-24T20:00:36Z,"Ah yes, my helath."
2024-11-24T19:20:49Z,Will this phone work on the same network as straight talk (from this seller)
2024-11-24T18:53:04Z,New Galaxy without bloatware
2024-11-24T18:35:03Z,[image processing failed]
2024-11-24T18:24:20Z,Floating Ad
2024-11-24T18:04:50Z,Samsung watch 7/s24 ultra
2024-11-24T18:00:47Z,Hello just wondering does the Galaxy A04s have Latin in the list of lanluages or will it be added in the future
2024-11-24T17:52:32Z,S24fe battery draining fast?
2024-11-24T17:41:21Z,Samsung 24fe
2024-11-24T17:33:10Z,Smart things? Dumb remote!
2024-11-24T17:31:13Z,Cleaning Fruit Drawer in my Samsung refrigerator?
2024-11-24T17:29:44Z,Has anyone got the unlocked Samsung S24 FE version to work on TracFone sim? 
2024-11-24T17:27:49Z,Has anyone got the unlocked Samsung S24 FE version to work on TracFone sim? I'm wondering if they are having the same issues with it not working like I had on my pixel 8 when it first released. I'm hoping it is supports Tracfone but I'm not sure because it is still new.
2024-11-24T17:27:13Z,S24 Ultra overheating while using the S Pen + S Pen burnt smell
2024-11-24T16:58:34Z,Case advice pls
2024-11-24T16:57:17Z,Keyboard improvements 
2024-11-24T16:40:33Z,Optimizacion
2024-11-24T15:57:46Z,Administrator?
2024-11-24T15:23:00Z,Samsung AI
2024-11-24T15:15:49Z,What does this mean?
2024-11-24T15:15:49Z,What does this mean?
2024-11-24T15:09:50Z,Galaxy A55/A35 visibility outside 
2024-11-24T15:05:22Z,Z Flip 6 Sim not allowed
2024-11-24T14:47:36Z,Choosing one from iPhone 16 Pro Max or S24 Ultra
2024-11-24T14:46:17Z,Galaxy s23 vs s24
2024-11-24T14:42:46Z,I plan to order S25 Ultra from Samsung website. Does anyone remember what were pre order deals for S24Ultra earlier this year on their website? 
2024-11-24T14:37:31Z,I deleted the 'downloads' folder by mistake - is it possible to get it back? 
2024-11-24T14:35:18Z,60Hz vs Adaptive 120Hz on midrangers
2024-11-24T14:33:48Z,A35 or Reman S21 Ultra
2024-11-24T13:58:10Z,Odyssey G80SD mute icon stuck flashing on screen.
2024-11-24T13:50:42Z,"S24FE users, how's yours holding up?"
2024-11-24T13:27:52Z,"Samsung A 55, will my version be compatible with 5g and data roaming."
2024-11-24T13:02:02Z,Help!
2024-11-24T12:53:56Z,How to download betting apps
2024-11-24T12:40:31Z,Samsung QLED TV deals for Black Friday? Where to look?
2024-11-24T12:34:22Z,New galaxy AOD on older devices
2024-11-24T12:01:50Z,No more accessories 
2024-11-24T11:57:24Z,No more accessories 
2024-11-24T11:20:49Z,Refurbished s22 or + in 2024?
2024-11-24T11:20:35Z,"Trying to connect GBuds2 with S93C, no success"
2024-11-24T11:18:18Z,Does my phone matter?
2024-11-24T11:09:00Z,Are idea
2024-11-24T11:01:18Z,"Daily Support Thread | November 24, 2024"
2024-11-24T10:58:23Z,Can you shrink the notification bar?
2024-11-24T10:42:04Z,Samsung has updated its rewards scheme and is now just crap
2024-11-24T10:35:55Z,Confused About Exynos 1480 and 1380.
2024-11-24T10:29:30Z,Has anyone figured out how to turn this new auto edit off? happens since the oneUI6.2 update
2024-11-24T10:17:22Z,Anyone still have a Galaxy Note 7?
2024-11-24T10:02:37Z,Which galaxy buds should I buy ?
2024-11-24T09:59:17Z,"I've just reported Samsung to the FTC for false advertising and you should do the same, or this BS will never end!"
2024-11-24T09:49:02Z,Report
2024-11-24T09:49:02Z,Report
2024-11-24T09:40:00Z,Can I get some advice with smartwatches here?
2024-11-24T09:26:36Z,Galaxy Buds3 Pro feel premium 
2024-11-24T08:59:45Z,Buds FE to Buds 3 Pro upgrade?
2024-11-24T08:48:41Z,Galaxy buds3 pro feel premium 
2024-11-24T08:48:41Z,Galaxy buds3 pro feel premium 
2024-11-24T08:47:42Z,Galaxy Buds3 Pro feel premium 
2024-11-24T08:47:42Z,Galaxy Buds3 Pro feel premium 
2024-11-24T08:43:51Z,Hey I just bought buds 2 pro and the audio keeps stuttering on pc
2024-11-24T08:34:21Z,"Galaxy Buds2 Pro Hearing Experiment + ""Flat"" Wavelet EQ"
2024-11-24T08:34:21Z,"Galaxy Buds2 Pro Hearing Experiment + ""Flat"" Wavelet EQ"
2024-11-24T08:14:20Z,Samsung is Shameless
2024-11-24T07:28:59Z,S24U r Wait for S25
2024-11-24T07:26:38Z,S24 ⭕r wait for S25
2024-11-24T07:25:35Z,Right side of my TV is faded black
2024-11-24T07:22:19Z,S24U r wait for S25
