Time Data,Headline
2024-04-21T06:20:44Z,Google and Bing??? 
2024-04-21T06:16:19Z,Camera App ProMode: has anyone been able to get an answer why Samsung destroyed RAW photo support in 2023?
2024-04-21T06:03:04Z,"Does Theme Park, show your created themes as applications in settings?"
2024-04-21T06:01:57Z,"Does Theme Park, show your created themes as apps? "
2024-04-21T05:53:50Z,Tab S9 Ultra stuck on Privacy Policy Updated screen. Can't go further.
2024-04-21T05:36:33Z,Severe battery usage during sleep
2024-04-21T04:30:33Z,S23 ultra - WhatsApp not recovering 
2024-04-21T04:25:38Z,Any good editing softwares for book 4 ultra
2024-04-21T04:07:31Z,optimisation
2024-04-21T03:34:12Z,Screenshot folder - Automatic sub folders
2024-04-21T03:10:19Z,Help
2024-04-21T03:09:58Z,Will dead pixels spread on s23 ultra?
2024-04-21T03:06:37Z,S10e can't use smartview
2024-04-21T02:21:58Z,Which phone? 
2024-04-21T02:20:20Z,Is there a way to go back to the old Android emojis?
2024-04-28T23:38:31Z,QN85C panel display time
2024-04-28T23:10:16Z,Circle to search A54?
2024-04-28T22:26:38Z,Taking photos of art?
2024-04-28T21:35:15Z,Question about corners with slanted cut outs. 
2024-04-28T21:01:50Z,Purchase help?
2024-04-28T21:01:50Z,Purchase help?
2024-04-28T20:54:02Z,I want to buy my first camera and I have a good budget
2024-04-28T20:51:46Z,Random file named with a bunch of number showed up in downloads folder on s24 ultra.
2024-04-28T20:25:51Z,Considering Switching from iPhone 11 to Samsung
2024-04-28T20:17:25Z,galaxy buds 2 pro right Barbuda not being loud 
2024-04-28T20:11:02Z,Which phone to get?
2024-04-28T19:52:55Z,Esim and PSim Data Intermittent
2024-04-28T19:24:45Z,Smart view won't cast to TV
2024-04-28T19:24:45Z,Smart view won't cast to TV
2024-04-28T19:19:07Z,S23 Ultra Oleophobic coating failed now screen protector stuck on screen
2024-04-28T19:18:43Z,S23+ esim and psim data won't connect 
2024-04-28T19:15:42Z,How to ACTUALLY get circle to search? Anything 3rd party?
2024-04-28T19:07:55Z,S23+ or S24?
2024-04-28T19:05:34Z,Image Scaling on my Galaxy tab A9 is broken
2024-04-28T19:03:43Z,Samsung ultra book 4  4070
2024-04-28T19:03:24Z,Would appreciate some feedback before I get an S24
2024-04-28T18:52:27Z,"A55, S22 Ultra or any S23?"
2024-04-28T18:30:44Z,Is a Samsung Q60C good enough if I don't care that much about high framerate?
2024-04-28T18:01:41Z,Recommendations for charger
2024-04-28T17:40:57Z,Is it only me but is using a tablet better than using a phone for entertainment? 
2024-04-28T17:24:45Z,Recommendations 
2024-04-28T17:14:33Z,Secure folder 
2024-04-28T17:06:53Z,Galaxy Buds 2 pro case
2024-04-28T16:44:39Z,S22 plus esim option not showing
2024-04-28T16:41:37Z,"Is it just me that dislikes the One UI 6 reminder app? The preset times aren't smart anymore. Before, if 8 AM passed, it would suggest 8 AM tomorrow, that feature is gone and seems like a step back."
2024-04-28T16:22:57Z,Help
2024-04-28T16:17:49Z,Issue on messenger audio and video call S24 Ultra
2024-04-28T16:08:09Z,Fingerprint sensor stops working after 5 days
2024-04-28T15:55:10Z,How do I improve the speed of A15?
2024-04-28T15:55:10Z,How do I improve the speed of A15?
2024-04-28T15:50:03Z,S24 and android auto not working. Orignal cable is a type C so I can't use it because my car work with a USB. Any fixes ? 
2024-04-28T15:47:53Z,Galaxy A55/A54
2024-04-28T15:31:45Z,why does S22 heat so muchh??
2024-04-28T15:03:01Z,S24 Exynos or Snapdragon?
2024-04-28T14:59:38Z,?
2024-04-28T14:39:06Z,sync issue
2024-04-28T14:33:54Z,Looking for a good upgrade from iPhone 11
2024-04-28T14:32:22Z,Can somebody please help me figure out how to use modes and routines? 
2024-04-28T14:31:40Z,Is S24ultra comfortable???
2024-04-28T14:13:57Z,S21 camera being bipolar 
2024-04-28T13:44:37Z,Does your S24 have scratches/dents on its frame?
2024-04-28T13:39:08Z,which phone would you get ? s24 or s23 ultra for 150 euros more ?
2024-04-28T13:28:04Z,"OneUI 6.1 breaks S23 and gets instantly attention from Samsung, yet OneUI 6.0 breaks A53 5G and Samsung doesn't care."
2024-04-28T13:25:53Z,Switch to Samsung S23 Ultra form S24 Plus (questions about color accuracy)
2024-04-28T13:25:53Z,Switch to Samsung S23 Ultra form S24 Plus (questions about color accuracy)
2024-04-28T13:01:29Z,Tv decision 
2024-04-28T12:45:09Z,Galaxy Book bursted (?). How much to I have to expect to pay for the repair (or is it covered by warranty?)
2024-04-28T12:44:06Z,How to use TWRP on my locked tablet?
2024-04-28T12:41:47Z,How to use TWRP on my locked tablet?
2024-04-28T12:38:32Z,Small issue with the camera A55
2024-04-28T12:06:15Z,IMEI blocking and rightful ownership after resale.
2024-04-28T11:43:02Z,S24 ultra record limit 10 minutes?
2024-04-28T11:26:09Z,Some questions about SAMSUNG Galaxy SmartTag2
2024-04-28T11:22:02Z,No update for my s22U since One Ui 5.1 
2024-04-28T11:12:22Z,S 23 bluetooth earphone problems
2024-04-28T10:32:50Z,Found a Samsung
2024-04-28T10:25:28Z,Modes Question
2024-04-28T10:23:25Z,S21 ultra or note 20 ultra (16gbvs12gb) (snapdragon)
2024-04-28T10:21:31Z,Can I transfer all of my data from one phone to another after factory reset?
2024-04-28T10:17:20Z,The power of Google AI comes to the new Samsung Galaxy S24 series
2024-04-28T10:17:20Z,The power of Google AI comes to the new Samsung Galaxy S24 series
2024-04-28T10:01:38Z,"Daily Support Thread | April 28, 2024"
2024-04-28T09:30:16Z,Apps force close whenever i opened once battery reach 24% below
2024-04-28T09:16:09Z,Google keeps disappearing 
2024-04-28T09:06:44Z,Galaxy A 53 5g Camera issue
2024-04-28T09:03:58Z,Does Samsung notes keep timestamps?
2024-04-28T09:01:22Z,Google keeps disappearing 
2024-04-28T08:55:22Z,Google keeps disappearing
2024-04-28T08:33:49Z,Region Lock s24
2024-04-28T08:26:29Z,"Delayed shipping for 77"" S90C TV"
2024-04-28T07:53:05Z,Charger for s24 ultra EU 25W or 15W? help me 
2024-04-28T07:49:34Z,Issues with Samsung 990 PRO (with Heatsink) firmware update on Ubuntu Server
2024-04-28T07:40:49Z,Hello I have a Samsung Note 10+ and I need help
2024-04-28T07:25:52Z,Switch between camera lenses
2024-04-28T07:07:21Z,Moondrop CHU II DSP voice call not working on S21 FE 
2024-04-28T07:02:36Z,I'm trying to change my icons to linebit light in theme park but it always crashes or doesn't save when I try it
2024-04-28T07:00:06Z,I'm trying to change my icons to linebit light in theme park but it always crashes or doesn't save when I try it
2024-04-28T06:59:08Z,I'm trying to change my icons to linebit light in theme park but it always crashes or doesn't save when I try it
2024-04-28T06:59:08Z,I'm trying to change my icons to linebit light in theme park but it always crashes or doesn't save when I try it
2024-04-28T06:46:20Z,Samsung S21 5G not charging properly
2024-04-28T06:44:55Z,Samsung 23/24 or Pixel 8
2024-04-28T06:37:22Z,Not sure how to pay for my s24 ultra
2024-04-28T06:20:08Z,Why is there no trash option in google messages?
2024-04-28T04:43:00Z,"s23 ultra wifi won't turn on, BT doesn't connect and S-Pen won't connect"
2024-04-28T03:21:01Z,How to make my Galaxy read my received text messages out loud. 
2024-04-28T02:53:53Z,What happened to my camera app? How do I get it back
2024-04-28T02:36:26Z,Samsung Update concerns.
2024-04-28T02:21:03Z,Trouble making decision
2024-04-28T02:09:37Z,Is $1000 USD a fair price for a Galaxy Book2 i7 with 512 GB SSD and 8 GB ram?
2024-04-28T01:53:39Z,Has anyone noticed OneUI 6.1 made Google Assistant Shit?
2024-04-28T01:28:15Z,Tv not letting me put it on the internet 
2024-04-28T01:28:15Z,Tv not letting me put it on the internet 
2024-04-28T01:21:44Z,Connecting tablet to PC
2024-04-28T01:12:13Z,Galaxy A12 took 6 hour to charge 10% battery
2024-04-28T00:20:51Z,Mobosi Z fold 5 case
2024-05-05T23:45:46Z,My smarttag 2 won't connect to my phone
2024-05-05T23:27:56Z,Z Fold 6 Hinge
2024-05-05T23:19:36Z,Samsung EPP - samsung employee
2024-05-05T23:17:38Z,Galaxy A05S in the us
2024-05-05T23:01:52Z,Samsung Pay/Wallet doesn't work
2024-05-05T22:29:49Z,Samsung A70 - Not charging after fall
2024-05-05T22:25:36Z,"Samsung a70 is not charging, need help"
2024-05-05T22:24:17Z,Why cant i trade in the same phones in different countries?
2024-05-05T22:10:58Z,"Samsung A23 discharged, not charging or rebooting. Upgrade issue?"
2024-05-05T22:06:40Z,My galaxy buds pro have insane battery drain issues
2024-05-05T22:04:41Z,Samsung A23 disharged not charging or booting up
2024-05-05T22:00:48Z,Samsung A23 discharged and won't charge or restart
2024-05-05T21:54:44Z,S24 Ultra
2024-05-05T21:52:53Z,"Galaxy S23 Plus, Verizon, current Android version"
2024-05-05T21:51:34Z,S22 Ultra Stuck in boot loop
2024-05-05T21:28:54Z,Is it possible to unlock the software on an A series phone so it can have some settings that are S series exclusive?
2024-05-05T21:27:19Z,Samsung calendar on Google calendar- how do I get rid of it?
2024-05-05T21:10:37Z,Share your wallpaper
2024-05-05T21:02:17Z,Samsung tab s6 lite (2022) v Samsung tab S7 FE?
2024-05-05T20:59:48Z,Screen stays on after notification 
2024-05-05T20:49:19Z,Slow charging 
2024-05-05T20:41:30Z,Samsung tv 
2024-05-05T20:40:53Z,Can I update my locked samsung s21 using smart switch on pc?
2024-05-05T20:36:45Z,S24U OIS issue
2024-05-05T20:36:45Z,S24U OIS issue
2024-05-05T20:35:53Z,Samsung Galaxy S22 Ultra System storage high
2024-05-05T20:19:19Z,My phone just can‘t turn on :(
2024-05-05T20:18:07Z,Samsung S24+ gps issues ?
2024-05-05T19:22:03Z,Venting on watch 6
2024-05-05T19:22:03Z,Venting on watch 6
2024-05-05T18:59:47Z,Samsung A15 images to PC (secure folder) question
2024-05-05T18:50:58Z,can overcharging on s22 ultra damage the battery?
2024-05-05T18:37:53Z,Do I have bad battery?
2024-05-05T18:07:34Z,"M34 users, whats your average screen on time?"
2024-05-05T18:07:34Z,"M34 users, whats your average screen on time?"
2024-05-05T18:01:04Z,S23 vs S23FE - near same price for CAD version?
2024-05-05T17:53:41Z,Concerned about notificatiom
2024-05-05T17:27:17Z,"Wanna upgrade, what to get."
2024-05-05T17:17:58Z,Got the new OLED S95D 55inches but
2024-05-05T17:12:59Z,Need advice
2024-05-05T17:10:32Z,Confusing Model names on the S24 Ultra
2024-05-05T17:05:52Z,Looking for perfect storage for s23 for a use of 3 years
2024-05-05T16:59:49Z,I deleted the edge panel service app and I want to get it back
2024-05-05T16:41:03Z,Having issues connecting Airtel sim as E-sim for watch 4 classic.
2024-05-05T16:18:41Z,Factory reset screwed me over BADLY
2024-05-05T16:11:57Z,Samsung a51 HELP pls
2024-05-05T16:05:24Z,Is Samsung on-line ordering always this painful?
2024-05-05T16:05:24Z,Is Samsung on-line ordering always this painful?
2024-05-05T15:26:26Z,Slow files transfer
2024-05-05T15:26:26Z,Slow files transfer
2024-05-05T15:25:09Z,Does Samsung Jet Bot+ clean multiple floors?
2024-05-05T14:55:32Z,S21 5g samsung
2024-05-05T14:45:44Z,Different back up size 
2024-05-05T14:25:44Z,My phone keeps randomly restarting
2024-05-05T14:09:06Z,S22 Ultra as laptop's second screen
2024-05-05T14:06:17Z,Outlook.com doesn't show up in Manage Accounts
2024-05-05T14:03:55Z,Question: How to get battery life back
2024-05-05T13:54:28Z,Samsung galaxy s23 or galaxy S23 FE 
2024-05-05T13:37:15Z,Samsung Odyssey G5 versions
2024-05-05T13:24:07Z,Switching from iPhone 14 Pro to S24 Exynos
2024-05-05T12:55:53Z,S23 ultra 8/256 or S24+ 12/512
2024-05-05T12:52:29Z,Galaxy A35 5G scratching problem
2024-05-05T12:24:40Z,"""Couldn't send message"" to anyone with an iphone."
2024-05-05T12:06:20Z,May I ask what is this?
2024-05-05T12:01:37Z,I've been looking for a phone upgrade currently have a oppo find X3 lite 
2024-05-05T11:58:06Z,Hello
2024-05-05T11:53:57Z,Salut am o problema la s24ultra 
2024-05-05T11:08:34Z,Samsung tab 9 fe keyboard problems
2024-05-05T11:08:33Z,Samsung tab 9 fe keyboard problems
2024-05-05T11:08:33Z,Samsung tab 9 fe keyboard problems
2024-05-05T11:08:26Z,Samsung tab 9 fe keyboard problems
2024-05-05T11:08:26Z,Samsung tab 9 fe keyboard problems
2024-05-05T11:06:29Z,Silicone case vs Spigen ultra hybrid case....for 23
2024-05-05T10:51:30Z,Galaxy S21 FE back cover slowly coming off
2024-05-05T10:41:33Z,I bought a samsung s24 ultra but type c to 3.5mm is not supported
2024-05-05T10:26:29Z,"6 weeks, constant delays with my S22 Ultra doorstop repair (UK). Where do I stand?"
2024-05-05T10:26:29Z,"6 weeks, constant delays with my S22 Ultra doorstop repair (UK). Where do I stand?"
2024-05-05T10:26:01Z,"Most people who say iPhone&gt;Android are just comparing $1000 phones to $200-300 ones.
"
2024-05-05T10:18:25Z,Am I crazy or does the display on the A54 look better than the S24  line
2024-05-05T10:14:13Z,Samsung step count vs Samsung walking app step count
2024-05-05T10:10:02Z,Upgrade from S10+ to s21 ultra (exynos) or Fold 3
2024-05-05T10:10:02Z,Upgrade from S10+ to s21 ultra (exynos) or Fold 3
2024-05-05T10:01:36Z,"Daily Support Thread | May 05, 2024"
2024-05-05T09:57:54Z,Secure folder pics deleted?
2024-05-05T09:57:54Z,Secure folder pics deleted?
2024-05-05T09:53:35Z,help 
2024-05-05T09:46:43Z,What’s the best budget Samsung Phone in 2024?
2024-05-05T09:34:11Z,Samsung AC not cooling
2024-05-05T09:34:05Z,Student discount in offline stores | INDIA
2024-05-05T09:33:01Z,Student discount in offline stores | INDIA
2024-05-05T09:24:34Z,Galaxy S21+ dilemma
2024-05-05T09:18:44Z,Samsung Chargers - 2.0 mm?
2024-05-05T09:02:58Z,Will a now buy bought Galaxy Z Flip 4 last me at least 2 years? 
2024-05-05T08:44:44Z,Help
2024-05-05T08:44:44Z,Help
2024-05-05T08:36:29Z,I can't tell the difference between qhd and fhd
2024-05-05T08:32:35Z,Samsung s24 HK variant usability in the PH?
2024-05-05T08:15:11Z,S24U Google Voice Assistant issue
2024-05-05T08:11:28Z,My routine - should I keep it?
2024-05-05T07:53:24Z,Samsung UE43KU6400 picture settings?
2024-05-12T23:54:25Z,Way to get Samsung Gallery on Pixel 8 Pro?
2024-05-12T23:44:18Z,New update today
2024-05-12T23:36:28Z,"Samsung scam: 58"" LCD screen replacement would cost 800.00 + services when a new Samsung 58"" TV costs 800 CAD"
2024-05-12T23:28:23Z,Which Galaxy to update from A52S for better camera?
2024-05-12T23:19:57Z,S23U at $800 or S24U at $1050
2024-05-12T23:19:57Z,S23U at $800 or S24U at $1050
2024-05-12T23:16:32Z,"Expert raw astrophotography, why does it say a 3"" sensor for half a second?"
2024-05-12T23:12:42Z,Samsung Car Key Fob Replacement 
2024-05-12T23:02:30Z,"My S10 has suddenly started automatically turning brightness to max on HDR Youtube videos. Phone and Youtube settings don't allow me to disable this annoying effect. What can I do, apart from be intermittently blinded?"
2024-05-12T22:45:28Z,Samsung T9 SSD LED Colors
2024-05-12T22:05:13Z,UE43CU8500 TV 4 days old keeps losing picture and showing static
2024-05-12T21:51:07Z,Power Saving question 
2024-05-12T21:41:51Z,You’ll are fucking thieves motherfuckers 
2024-05-12T21:30:14Z,"Any reviews about Samsung EB-P3400XUEGEU, 10000 mAh powerbank?"
2024-05-12T21:21:12Z,The A series confuses me. 
2024-05-12T21:20:56Z,Samsung s 20+ data recovery 
2024-05-12T21:16:01Z,Does Samsung Galaxy support an application only at certain period of time?
2024-05-12T21:08:59Z,Samsung A21s death! HELP!!!!!
2024-05-12T20:25:04Z,How much of an upgrade is the S23 FE from the iPhone 7?
2024-05-12T20:22:19Z,Samsung is Trash
2024-05-12T20:11:17Z,green dot top right  
2024-05-12T20:09:48Z,Voice 
2024-05-12T19:56:16Z,Fast charging power bank
2024-05-12T19:48:52Z,Soundbar HW Q810b + PC + TV
2024-05-12T19:45:22Z,Cable vs Adapter for Dex
2024-05-12T19:37:30Z,"Im trying to connect my tab s9 to my monitor. But, it doesnt have any sound coming out of my tab"
2024-05-12T19:26:52Z,Help
2024-05-12T19:20:26Z,Samsung pay problem
2024-05-12T19:08:55Z,Overheating problems
2024-05-12T19:00:15Z,"""Lock"" screen"
2024-05-12T18:58:01Z,I need some help....
2024-05-12T18:50:24Z,Nonlinear animations
2024-05-12T18:39:23Z,Is there a way to change my settings to where I no longer have to unlock my phone just to turn wifi or Bluetooth off?
2024-05-12T18:37:14Z,"Can I get a monitor and connect my s24u via USB and watch apps though phone data, without a separate WiFi connection?"
2024-05-12T18:26:31Z,Which phone should I get my partner? Please 🙏 
2024-05-12T18:25:59Z,"recently got green line issue on s21 ultra, how much time and money would it cost?"
2024-05-12T18:15:15Z,"If I go to any official Samsung Repair Centre,"
2024-05-12T17:56:17Z,Bottom speaker suddenly stopped working
2024-05-12T17:52:05Z,S24 Ultra Refresh Rate in games
2024-05-12T17:41:51Z,Thinking I might switch from iPhone. Do you galaxy users mostly use the Samsung apps or the Google apps or a mish mash of both?  
2024-05-12T17:29:20Z,a53 or a55
2024-05-12T17:19:05Z,Looking to purchase a Galaxy Watch
2024-05-12T17:19:05Z,Looking to purchase a Galaxy Watch
2024-05-12T17:15:52Z,Fingerprint sensor's not detecting
2024-05-12T17:08:34Z,Looking to purchase a Galaxy Watch
2024-05-12T16:59:17Z,Google Safe Folder backup?? (Deleted files)
2024-05-12T16:53:44Z,Pls answer this
2024-05-12T16:53:11Z,"How to set/create ""conversations""? "
2024-05-12T16:52:43Z,S24+ buy advice
2024-05-12T16:47:13Z,does anybody already have the Samsung M15 5g? Would you please post a couple pictures taken of text or books or newspapers?
2024-05-12T15:33:05Z,Switched phones and my photos arent here...
2024-05-12T14:57:35Z,Will Samsung phone eventually stop supporting an app and ask to upgrade the phone?
2024-05-12T14:48:23Z,I have a problem
2024-05-12T14:27:42Z,Buy Galaxy tab s9+ or wait
2024-05-12T14:27:42Z,Buy Galaxy tab s9+ or wait
2024-05-12T14:09:33Z,Help with notifications after switching phones
2024-05-12T13:54:22Z,Am I the only one who thought J series were junior series and S series were Senior series 
2024-05-12T13:42:14Z,J Series Screen Off Animation
2024-05-12T13:05:08Z,S21 Ultra screen unresponsive
2024-05-12T13:04:52Z,S24 camera problem 
2024-05-12T12:44:04Z,Accidentally charged Galaxy Watch 3 with wrong charger
2024-05-12T12:32:08Z,Galaxy Book Pro Help - Automatic Repair Loop &amp; Factory Reset Errors
2024-05-12T12:26:00Z,Is the S 3 Mini Dead
2024-05-12T12:22:34Z,samsung galaxy versions
2024-05-12T12:02:32Z,Can't find the Device Health Services app (A52)
2024-05-12T11:59:12Z,"GSam Battery Monitor Pro, my honest opinion "
2024-05-12T11:55:25Z,How to fix lag on A series phones
2024-05-12T11:48:24Z,Connection mouse to Tablet
2024-05-12T11:21:03Z,I'm drained! - Galaxy Watch 6
2024-05-12T10:10:28Z,Samsung S22 sometimes vibrates and buzzes when I zoom in from the camera
2024-05-12T10:01:25Z,"Daily Support Thread | May 12, 2024"
2024-05-12T09:48:40Z,How to change touch controls on non samsung earbuds?
2024-05-12T09:24:11Z,Samsung S22 ringtone doesn't work after updating to 6.1
2024-05-12T09:23:48Z,Anyone with the S22 ultra 512 that also has a problem with adding E-sim? 
2024-05-12T09:13:25Z,My Galaxy S20 won't accept my pin
2024-05-12T09:08:37Z,Is it possible to merge two backups from the same phone?
2024-05-12T08:49:20Z,i need help for the last week i have been trying to transfer whats app from iPhone to android the official method always fails every time
2024-05-12T08:33:04Z,My mouse won't pair
2024-05-12T08:28:58Z,Should i get Samsung A35 or A54
2024-05-12T08:21:16Z,Why is my tv showing Hot Wings on repeat?!
2024-05-12T07:34:25Z,S24 Ultra scrolling issues
2024-05-12T07:32:28Z,galaxy s24 screen protectors making me nauseas 
2024-05-12T07:19:09Z,i have a older s9 phone  how can   compare 3 or 4models to find out whats best for me?
2024-05-12T06:12:33Z,When will s24 ultra titanium be released in the Ph?
2024-05-12T05:34:55Z,Wanting to switch from iphone to s24. Husband is kinda freaking out over it. help 
2024-05-12T04:57:31Z,Information given is ''REF: SAMA55_5G8256NAVEU Versión Europea''. Could there be warranty or other problems when living in Spain?
2024-05-12T04:54:51Z,Doubt by buying an A55 european version and living in Spain. The information given is ''REF: SAMA55_5G8256NAVEU Versión Europea''. Could there be warranty or other problems when living in Spain?
2024-05-12T04:51:21Z,"Got offered Circle to Search, but in the demo Google Lens is showing instead."
2024-05-12T04:11:37Z,How to factory reset if u didn't have Google account linked?
2024-05-12T03:42:35Z,Samsung 50 QN90B and volume control on sound bar
2024-05-12T03:33:10Z,Is it worth repairing a slightly broken S22 Ultra or should i trade it in/upgrade to something else.
2024-05-12T03:33:10Z,Is it worth repairing a slightly broken S22 Ultra or should i trade it in/upgrade to something else.
2024-05-12T03:16:46Z,Burn mark on phone
2024-05-12T03:16:32Z,Burn mark on phone
2024-05-12T03:11:59Z,How to Remove Bixby Ad From Home Button
2024-05-12T02:46:26Z,Advice on purchasing Samsung A15 4g Malaysia and problem faced
2024-05-12T02:14:59Z,Budget secondary samsung phone from iphone to use for android features
2024-05-12T01:43:19Z,Phone case for aftermarket screen
2024-05-12T00:57:14Z,What about the USB-C port for headphones and charging?
2024-05-12T00:52:46Z,Who Else thinks Galaxy S24 is is a Downgrade from the S22?
2024-05-19T23:57:03Z,Unresponsive phone screen.
2024-05-19T23:47:39Z,55'' QN85C or 50'' QN90C
2024-05-19T23:37:24Z,Switching to zflip 5
2024-05-19T22:24:14Z,Samsung Tab s9 Ultra USB Hub
2024-05-19T22:18:16Z,Samsung tab s9 ultra USB Hub
2024-05-19T22:16:40Z,How good is the workflow with windows
2024-05-19T22:14:25Z,Custom AOD no longer possible?
2024-05-19T22:14:18Z,Question about phone case
2024-05-19T21:53:36Z,"S22 ultra , one ui 6.1 crashes "
2024-05-19T21:50:46Z,Question regarding the live drawing/learn to draw in the pen up app
2024-05-19T21:48:30Z,Samsung Galaxy best discounts/deals?
2024-05-19T21:46:40Z,Charger randomly died
2024-05-19T21:33:52Z,TV Plus not on one device
2024-05-19T21:14:11Z,Samsung Terrace TV Streaks
2024-05-19T21:07:06Z,Why do so many people complain about the smallest things with the S24 Ultra?
2024-05-19T21:04:29Z,Lost Gallary 
2024-05-19T20:24:01Z,Laggy swipe gesture 
2024-05-19T20:12:03Z,Icon setting doesn't appear in Theme Park
2024-05-19T19:59:04Z,The s24u has a terrible display
2024-05-19T19:42:05Z,samsung SSD not recognized by samsung magican software plugged into samsung galaxy book 3 360
2024-05-19T19:03:11Z,Found this ancient text in the settings
2024-05-19T18:56:37Z,Digital Card number 
2024-05-19T18:44:59Z,S24 display issues
2024-05-19T18:38:18Z,Tv won’t update anymore
2024-05-19T18:23:16Z,S24 Ultra vs S24 plus for video recording recommendation 
2024-05-19T18:02:21Z,The tiniest crack has broken my entire tv.
2024-05-19T17:57:31Z,Headphone Volume Issues
2024-05-19T17:41:08Z,Should I buy s9 tablet ultra or wait for s10 ultra 
2024-05-19T17:21:05Z,Battery Drain
2024-05-19T17:18:06Z,Screenshot-20240519-194721-Device-care hosted at ImgBB
2024-05-19T17:18:06Z,Screenshot-20240519-194721-Device-care hosted at ImgBB
2024-05-19T17:16:42Z,"my S24, 3hrs SoT"
2024-05-19T17:10:36Z,"Hello Friends, I Have A Question For You? "
2024-05-19T17:05:14Z,Looking for older models with snapdragon and dual sim in US 
2024-05-19T17:00:25Z,Insanity
2024-05-19T16:58:50Z,S24 vs s24+ vs iPhone 15
2024-05-19T16:30:57Z,How do I get rid of smart things notification
2024-05-19T16:30:57Z,How do I get rid of smart things notification
2024-05-19T16:16:15Z,Tablet help 
2024-05-19T16:12:32Z,Samsung Hospital
2024-05-19T16:11:57Z,S24 terrible shadows in pictures
2024-05-19T16:07:11Z,Which One Should I Get? Galaxy Watch 6 Classic LTE vs. 5 Pro LTE
2024-05-19T16:05:11Z,Power Button not working
2024-05-19T15:57:06Z,How to fix my phone
2024-05-19T15:55:45Z,What's the best clear case for the 24 ultra?
2024-05-19T15:39:58Z,Why Samsung Has Lost Its Edge: A Frustrated User's Perspective
2024-05-19T15:24:21Z,Slow connection on brand new S9 fe tablet
2024-05-19T15:18:24Z,How to transport the Galaxy Xcover Pro6 spare battery? Any cases available?
2024-05-19T14:53:47Z,Samsung experience stores are the worst
2024-05-19T14:33:28Z,Samsung s24 vs s24+
2024-05-19T14:16:37Z,White Screen on 2nd Device this week. Any help?
2024-05-19T14:08:18Z,Samsung Range turned on by itself
2024-05-19T14:06:21Z,Game Booster/Plugin issue
2024-05-19T14:03:43Z,Random alarm noise?
2024-05-19T13:45:42Z,Pvz doesn't support touch s23u
2024-05-19T13:11:45Z,Gestures 
2024-05-19T13:08:42Z,S22 battery help
2024-05-19T13:02:14Z,Upgrade
2024-05-19T13:01:59Z,Upgrade
2024-05-19T12:58:01Z,Dodgy price for s23 ultra
2024-05-19T12:53:48Z,Purple nav bar
2024-05-19T12:49:43Z,Help! Can we change the color of the nav bar? 
2024-05-19T12:49:43Z,Help! Can we change the color of the nav bar? 
2024-05-19T12:46:53Z,S22+ or s21 ultra Which one should I buy?
2024-05-19T12:30:08Z,Samsung A23
2024-05-19T12:15:25Z,S23u lagging
2024-05-19T12:11:10Z,3 years of research...
2024-05-19T12:10:30Z,3 years of research...
2024-05-19T12:07:16Z,Is the Google pen and other stylus as good as the s-pen
2024-05-19T11:55:43Z,Secure folder how to use it?
2024-05-19T11:32:44Z,Charging port won't read on S24+ after getting phone wet in ocean. 
2024-05-19T11:15:19Z,Galaxy Note 8 Bootloop unfixable??
2024-05-19T11:13:46Z,S22 grid like display on videos
2024-05-19T11:03:45Z,Battery cycles reset S10Lite
2024-05-19T10:17:16Z,"Hello I am in spain , i am planning to get the s24 , 256 gb with exynos with a 30% discount (offer for my company), I am searching for honest feeding for people who bought the phone , should i go for it ? Or just get the s23 ?   Battery life , performance, i should notice that i m not a gamer "
2024-05-19T10:16:13Z,Live Captions
2024-05-19T10:09:02Z,Flash Hong Kong Galaxy S24 Ultra with Firware from different region
2024-05-19T10:01:31Z,"Daily Support Thread | May 19, 2024"
2024-05-19T10:00:58Z,Google hum song not working?
2024-05-19T09:17:43Z,How to unlock the network of Samsung a52 5g?
2024-05-19T08:55:29Z,How can Unlock my Samsung a52 5g to network lock?
2024-05-19T08:51:17Z,Find my.phone
2024-05-19T08:50:54Z,UNLOCKING CARRIER LOCK (SAMSUNG A52 5G US VERISION)
2024-05-19T08:42:19Z,No Messages notifications
2024-05-19T08:38:17Z,Guys s23 fe or pixel 8a? 
