Time Data,Headline
2024-01-07T23:52:25Z,One ui 6 beta
2024-01-07T23:41:00Z,I need some help with trade in
2024-01-07T23:05:48Z,A52 stuck in boot loop after ui 6.0 update
2024-01-07T23:05:48Z,A52 stuck in boot loop after ui 6.0 update
2024-01-07T22:57:44Z,Will gaming damage my battery?
2024-01-07T22:57:44Z,Will gaming damage my battery?
2024-01-07T22:50:27Z,Samsung TV retail mode on
2024-01-07T22:16:03Z,Note10+ to S23
2024-01-07T22:14:54Z,Switching
2024-01-07T22:14:54Z,Switching
2024-01-07T22:06:59Z,Can the Galaxy-S6 decode h265/hevc videos...?
2024-01-07T21:52:45Z,using 65 W charger to charge Samsung s23 ultra ?
2024-01-07T21:46:44Z,Memory upgrade on S20 Ultra
2024-01-07T21:45:36Z,Is there a way to turn off ai upscaling?
2024-01-07T21:45:36Z,Is there a way to turn off ai upscaling?
2024-01-07T21:45:19Z,Galaxy Note 10.1 - Ideas needed
2024-01-07T21:30:13Z,How come Samsung ships TVs with such a terrible user interface?
2024-01-07T21:08:57Z,"Has anyone ever actually had the ""Camera Fail"" issue repaired?"
2024-01-07T20:19:56Z,Touchscreen doesnt react after latest Update
2024-01-07T20:15:19Z,Alarm sounds
2024-01-07T20:12:56Z,Thinking of moving to Samsung after having iPhone for so long
2024-01-07T20:04:12Z,"Standby HDMI Passthrough ""JU6050"""
2024-01-07T19:57:22Z,"What screws do I need for my SAMSUNG QN90A 55"" TV to fit to the stand?"
2024-01-07T19:52:47Z,Does Netflix work at 1080p on Dex in One UI 6?
2024-01-07T19:52:47Z,Does Netflix work at 1080p on Dex in One UI 6?
2024-01-07T19:51:26Z,Does Netflix work at 1080p on Dex in One UI 6?
2024-01-07T19:44:23Z,Earbud 2 pro replacement
2024-01-07T19:34:38Z,how do i make it so when i want my phone to rotate it doesn't do it automatically but i need to press a button that apears i have it on my Samsung tablet and i dont know how to have it on my phone
2024-01-07T19:32:49Z,How to you remove the option of unlocking the screen on s23 with touch?
2024-01-07T19:32:49Z,How to you remove the option of unlocking the screen on s23 with touch?
2024-01-07T19:20:51Z,Samsung Dex on S23 Ultra
2024-01-07T19:06:03Z,Question about the Samsung A54
2024-01-07T19:00:29Z,status bar gone/dissappeared
2024-01-07T18:54:56Z,How to know I’m blocked
2024-01-07T18:54:56Z,How to know I’m blocked
2024-01-07T18:47:22Z,Screen resilience vs other manufacturers
2024-01-07T18:36:26Z,Whats the best value phone in the A series line
2024-01-07T18:34:49Z,I baked my earbuds 2
2024-01-07T18:32:33Z,A13 camera don't focus
2024-01-07T18:23:21Z,Upgrading from a73 to s23+
2024-01-07T18:22:52Z,Samsung Intros 2024 Odyssey OLED Gaming Monitors: Up to 49-Inches and 360Hz
2024-01-07T18:19:16Z,S23 Price Drop at Samsung Shop
2024-01-07T18:18:00Z,Help decide on a TV...~EUR600
2024-01-07T18:17:45Z,So I can't find Good Lock in the Galaxy store
2024-01-07T18:17:32Z,Best streaming device for new TV owner?
2024-01-07T18:06:11Z,Does anyone have a spare Samsung UK birthday code?
2024-01-07T17:36:30Z,"Users of Samsung A24, Should I buy A24 (8/128)?"
2024-01-07T17:26:53Z,Buy Exynos or wait for SD8?
2024-01-07T17:21:19Z,S23 price adjustments soon?
2024-01-07T17:20:01Z,Huge pricing gap on the same phone
2024-01-07T17:18:49Z,Anyone got a spare Samsung UK birthday discount code please?
2024-01-07T16:46:30Z,Flip 4 shuts down right after 5.1.1
2024-01-07T16:41:20Z,"Upgrading from the s20, what phone should I upgrade to?"
2024-01-07T16:40:53Z,Phone switches from 5G to LTE when heating up
2024-01-07T16:30:25Z,Galaxy Watch 6 LTE eSIM purchase?
2024-01-07T16:30:25Z,Galaxy Watch 6 LTE eSIM purchase?
2024-01-07T16:25:23Z,Switching from S22 Ultra
2024-01-07T16:01:48Z,How do mid rangers preform day to day?
2024-01-07T16:01:48Z,How do mid rangers preform day to day?
2024-01-07T15:59:25Z,Samsung airdresser question
2024-01-07T15:38:59Z,Monitor no HDMI signal
2024-01-07T15:38:32Z,Samsung buds 2 Pros keep cutting out when connected to a PC
2024-01-07T15:19:34Z,Audio issue with Xbox Series X
2024-01-07T14:57:46Z,Trying to find the right plug for Samsung Wireless charger duo...
2024-01-07T14:54:22Z,Trying to find the right plus for Samsung Wireless charger duo...
2024-01-07T14:54:22Z,Trying to find the right plus for Samsung Wireless charger duo...
2024-01-07T14:54:18Z,I just had a random thought about the Samsung Galaxy Tab S10 Ultra.
2024-01-07T14:41:34Z,My QN90C doesn’t connect with my HW-Q990C Soundbar through WI-FI.
2024-01-07T14:39:22Z,Weird ticking noise from internal speakers on S90C TV
2024-01-07T14:11:47Z,"Call Background Video,sound is not used during a call."
2024-01-07T14:06:57Z,Bypass authentication for Samsung dex?
2024-01-07T13:46:38Z,How to fix s-pen?
2024-01-07T13:46:08Z,S8 Ultra vs S9 Ultra
2024-01-07T13:45:54Z,Need Help Transferring Data From a Broken Samsung Galaxy S7
2024-01-07T13:44:59Z,Samsung accessibility for color blindness in One Ui
2024-01-07T13:34:16Z,Please help with some tips on preserving my buttons on my S7 Edge
2024-01-07T13:28:25Z,Grainy photos at +than 3x pre processing
2024-01-07T13:17:13Z,Is it worth buying the Galaxy Buds2 Pro?
2024-01-07T13:17:13Z,Is it worth buying the Galaxy Buds2 Pro?
2024-01-07T13:02:19Z,US Samsung Trade in - Device Bought Outside of US
2024-01-07T13:00:42Z,TV samsung and two menus locked
2024-01-07T12:35:45Z,Stuck in a bootloop
2024-01-07T12:25:09Z,Screen aspect ratio of S24+?
2024-01-07T12:04:00Z,Will factory resetting my phone revokes right for Cashback?
2024-01-07T12:04:00Z,Will factory resetting my phone revokes right for Cashback?
2024-01-07T11:57:04Z,Samsung flip 5
2024-01-07T11:45:14Z,Should I do it?
2024-01-07T11:44:18Z,What would you replace a note 20 ultra with today?
2024-01-07T11:31:32Z,Ok should i got for the tab s8 ultra
2024-01-07T11:29:34Z,Galaxy buds pro only works in a certain position (or if I adjust them)
2024-01-07T11:12:48Z,Samsung Galaxy S24 Ultra - First Look
2024-01-07T11:02:38Z,Whatsapp and telegram calls not showing on lackscreen.
2024-01-07T11:01:43Z,S23+OneUI6 issues
2024-01-07T11:00:57Z,Will S23+ Price Drop once the S24 Series is released in February?
2024-01-07T11:00:37Z,Daily Support Thread
2024-01-07T10:42:43Z,S24 base lacks so much
2024-01-07T10:25:15Z,Which Samsung phone had the best design in terms of aesthetics?
2024-01-07T10:22:28Z,Samsung galaxy flip 3 stuck in bootloop.
2024-01-07T10:20:02Z,Samsung flip 3 stuck in bootloop after updating Android system webview.
2024-01-07T10:11:54Z,How to turn off screen dimming lock
2024-01-14T23:58:58Z,i think i messed up in the service menu and idk what to do now
2024-01-14T23:49:35Z,Problem ordering from official Samsung website
2024-01-14T23:44:17Z,"Would you be up for ""Galaxy S9+/Note 9 VE""?"
2024-01-14T23:31:44Z,"Mt friends all make fun of me for the fact that I use an samsung and how the green bubble pisses them off, is there anyway for me to text them without the green bubble that doesn't include me getting an iphone?"
2024-01-14T22:33:12Z,Q80C QLED Game Mode Best Settings
2024-01-14T22:24:57Z,Opinion on Crystal UHD TVs
2024-01-14T22:12:40Z,"Sound issues, need help"
2024-01-14T22:12:27Z,Looks like S23 Ultra 1TB trade in value in Germany is €750.
2024-01-14T22:01:12Z,Will there ever be another budget phone with a home button
2024-01-14T21:53:29Z,G998u1 still no 6.0 s21 Ultra
2024-01-14T21:21:25Z,Connecting PS5 to Viewfinity S9
2024-01-14T20:58:38Z,How much do you think trade in will be for S22U and S23U?
2024-01-14T20:27:38Z,Samsung Repair Caused More Permanent Damage
2024-01-14T19:54:29Z,"Samsung Galaxy K758 series coming up, listed on Bluetooth SIG certification."
2024-01-14T19:52:42Z,"Google apps are red after enabling ""Force Dark mode"" in dev settings"
2024-01-14T19:48:41Z,i changed something in service menu and i messed up
2024-01-14T19:44:28Z,s23 after factory reset locked out via pin from previous owner i dont have - HELP PLZ!!!
2024-01-14T19:41:05Z,My Samsung Galaxy a10 geekbench 5 results
2024-01-14T19:40:30Z,"Google apps are red after enabling ""Force Dark mode"" in dev settings"
2024-01-14T19:39:32Z,S21 fe or s21
2024-01-14T19:38:20Z,Why do Samsung tvs and TVs in general have so complicated names
2024-01-14T19:35:18Z,Which type of Samsung tvs should someone avoid
2024-01-14T19:34:39Z,Gaming hub for qe43qn90bat
2024-01-14T19:21:09Z,Bluetooth doesn't connect
2024-01-14T19:08:44Z,Anyway to fix this at all? (Samsung Galaxy A11)
2024-01-14T19:07:44Z,Do you believe the rumors that the base s24 will not have a 512 GB storage option?
2024-01-14T19:05:27Z,Video player suggestions
2024-01-14T18:57:37Z,Samsung 990 pro problems
2024-01-14T18:32:15Z,my phone display suddenly freezes for a moment!!!
2024-01-14T18:08:21Z,"Any way to change resolution on a Samsung 55"" Class RU730D?"
2024-01-14T18:05:02Z,Planned obsolescence Gear Fit 2 Pro
2024-01-14T18:05:01Z,Planned obsolescence Gear Fit 2 Pro
2024-01-14T17:37:07Z,Smart Tags location sharing non-Samsung phones
2024-01-14T17:32:13Z,A thousand pictures from my downloads folder mysteriously disappeared. Could it be because my storage was almost full at the time?
2024-01-14T17:31:13Z,5g connection improvement?
2024-01-14T17:29:40Z,Does anyone have a in app ad blocker
2024-01-14T17:04:24Z,"Galaxy Tab S9+ 12.4” 512GB only $870 today, sounds very tempting now"
2024-01-14T17:01:37Z,Galaxy book 3 ultra or wait for 4 ultra
2024-01-14T16:58:55Z,Samsung S7 dead - can't wake it up
2024-01-14T16:52:59Z,Local dimming setting
2024-01-14T16:34:52Z,Why is the S24+ bigger than the S23+?
2024-01-14T16:33:04Z,Samsung 50% off their phones
2024-01-14T16:27:00Z,Hey google on s23
2024-01-14T15:54:29Z,Im done with samsung
2024-01-14T15:51:51Z,TV Smart Remote
2024-01-14T15:43:35Z,Phone Case for Old Models
2024-01-14T15:34:50Z,Why does Samsung love the 3-button navigation bar?
2024-01-14T15:29:03Z,Why do galaxy phones always install bloatware during updates?
2024-01-14T15:19:28Z,Screen protector for Samsung Galaxy S23 Ultra
2024-01-14T15:17:26Z,Where is the finder?
2024-01-14T15:09:27Z,"Samsung Galaxy S24 Series To Compete With Google Pixel 8, Likely To Get OS Updates For 7 Years"
2024-01-14T14:37:31Z,Old Apps in Play Store
2024-01-14T14:34:07Z,Choose your screen protector wisely.
2024-01-14T14:29:32Z,Samsung Ballie 2024
2024-01-14T14:28:59Z,Samsung A54 vs S21 FE vs S23 FE
2024-01-14T14:28:03Z,S 22/23 ultra Panzer Glass
2024-01-14T13:38:19Z,Camera failed on Note20
2024-01-14T13:37:25Z,[Question] Samsung TV does not let me change audio language
2024-01-14T13:27:46Z,Samsung GALAXY S23 la eMAG cu Reduceri Mari Inaintea Lansarii Samsung GALAXY S24
2024-01-14T13:25:37Z,I think i won't upgrade my smartphone this year
2024-01-14T13:23:35Z,S23 vs S23+
2024-01-14T13:13:54Z,S23 Price Drop post launch of S24?
2024-01-14T13:08:45Z,Phone Software Update Failed - options?
2024-01-14T12:59:42Z,Samsung Odyssey connections help
2024-01-14T12:47:33Z,Fix for not charging
2024-01-14T12:45:28Z,Getting the S23 FE soon
2024-01-14T12:13:17Z,Accessory recommendation to complement S24U?
2024-01-14T11:34:36Z,Moving pictures from tv to phone
2024-01-14T11:30:19Z,Battery got worse on s23 ultra after new security patch?
2024-01-14T10:34:24Z,Does Call &amp; Text on other devices work between two phones
2024-01-14T10:13:51Z,S23 Ultra After 1 Year Review (Pls give feedback :))
2024-01-14T10:10:55Z,Differences between european/chinese/american versions?
2024-01-14T09:37:50Z,Was typing and the update dialog appeared and now my phone is updating :(
2024-01-14T09:06:47Z,Samsung Note 8 is surprisingly good in 2024
2024-01-14T09:03:50Z,S24U Deals Guide?
2024-01-14T08:30:59Z,File choose
2024-01-14T08:10:57Z,Galaxy S23 price drop query
2024-01-14T08:02:43Z,Battery Drain on the Fold 5
2024-01-14T07:48:18Z,Baseus Gan3 30w charger for S23
2024-01-14T07:32:27Z,S10 5G to 23 Ultra?
2024-01-14T07:31:00Z,Samsung Galaxy S24 or S24 Ultra?
2024-01-14T07:27:52Z,Note 9 to S24U
2024-01-14T07:17:49Z,OneUI 6 Loop on brand new S23
2024-01-14T06:34:28Z,"Did samsung remove the ""mobile networks"" tab under settings-&gt;connections?"
2024-01-14T06:25:46Z,Updates
2024-01-14T05:54:22Z,New system update installed games on my phone?
2024-01-14T05:27:09Z,Is it safe to download filters in samung photo editor app cuz it’s from third party’s apps like camera 360..?
2024-01-14T05:26:28Z,Just bought galaxy s21. Good or Bad?
2024-01-14T05:06:35Z,Repair or trade s22 ultra?
2024-01-14T04:49:21Z,need help with samsung rewards
2024-01-14T04:43:04Z,Notification bar not working on Galaxy S10+
2024-01-14T04:32:00Z,Exynos 2400 vs Snapdragon 8 gen 2?
2024-01-14T04:23:40Z,Samsung G9 Ultrawide Green line. Line Was removed with Firmware update but came back.
2024-01-14T04:21:57Z,Confusion about Matter support (2022 The Frame TV)
2024-01-14T04:12:01Z,Samsung The Frame with very low voice
2024-01-14T03:48:12Z,I would like to know about advantages and disadvantages of curved screen and which you like the most ? Why? Thanks for the answers.
2024-01-14T03:17:06Z,Do you find the S ultras a bit manly
2024-01-14T03:07:54Z,Random pop-ups from Samsung internet
2024-01-14T03:00:50Z,Google app keeps crashing with Oneui 6
2024-01-14T02:59:02Z,Google app keeps crashing worh Oneui 6
2024-01-21T23:53:47Z,Are software updates now automatic without an option to turn it off?
2024-01-21T23:52:31Z,S22 ultra or s23 ultra?
2024-01-21T23:23:29Z,Worth going from an iPhone SE 2020 to Samsung A14?
2024-01-21T23:18:45Z,Whitestone Dome glass + Otterbox defender?
2024-01-21T23:05:54Z,4C error on washer
2024-01-21T22:25:59Z,Poor picture quality
2024-01-21T21:51:01Z,"EXYNOS 2400 vs SD 8 Gen 3, which one will have better real-life performance?"
2024-01-21T21:50:02Z,Samsung or Google apps?
2024-01-21T20:34:37Z,I am in Samsung's Marketing Case Competition and would love your help on my research!
2024-01-21T20:25:23Z,Do you care about WIFI7 on your smartphone?
2024-01-21T20:00:09Z,Worth upgrading from iphone 13PM to S24U ?
2024-01-21T19:14:29Z,Q90T HDR
2024-01-21T19:14:24Z,Will the S23 have all the AI features that the S24 will have?
2024-01-21T18:45:08Z,ONE UI 6 navigation glitch...
2024-01-21T18:32:38Z,S24 512GB?
2024-01-21T18:29:06Z,UK GALAXY S24 SERIES PRE REGISTER CODE
2024-01-21T18:28:12Z,Upgrading from S20+ to S23+ or S24+
2024-01-21T18:17:46Z,Did anyone else pre-order the regular S24?
2024-01-21T18:17:46Z,Did anyone else pre-order the regular S24?
2024-01-21T18:14:17Z,"Did anyone else get the S24 over the S24+ or S24 Ultra? If so, what are your reasons?"
2024-01-21T18:14:17Z,"Did anyone else get the S24 over the S24+ or S24 Ultra? If so, what are your reasons?"
2024-01-21T17:52:17Z,What is the best Video Player to watch movies.
2024-01-21T17:50:07Z,Exynos 2400 vs Snapdragon 8 Gen 3
2024-01-21T17:43:26Z,Should I upgrade from Note 10 plus to S24 ultra?
2024-01-21T17:36:43Z,Upgrade from note 10 plus to S24 ultra
2024-01-21T17:02:50Z,Removing the option to hide Gesture Hint is the biggest downgrade in One UI in terms or looks. What do you think
2024-01-21T16:40:01Z,Samsung Galaxy S24 Ultra - 72 HOURS Later! [First Review] - The Tech Chap
2024-01-21T16:01:05Z,what country's have s24 international version with unlocked bootloader?
2024-01-21T16:00:22Z,Samsung Q930B soundbar without a sub in an Apartment?
2024-01-21T15:42:54Z,Galaxy S24+ is the best phone to buy
2024-01-21T15:42:54Z,Galaxy S24+ is the best phone to buy
2024-01-21T15:39:30Z,Speech to text function
2024-01-21T15:39:30Z,Speech to text function
2024-01-21T14:27:00Z,Change Trade in Device after Purchase
2024-01-21T14:13:06Z,Upgrading to a new phone and switching away from ApPlE
2024-01-21T13:49:06Z,My S22 plus didnt get the update one UI 6 yet I dont know why and I dont hate the current version im on Im checking if there's an issue with my phone
2024-01-21T13:36:04Z,TV CU8079 App Support?
2024-01-21T13:27:45Z,Trade in OnePlus 11
2024-01-21T12:51:10Z,"How to unlink student account from samsung account, I linked my student account to the wrong samsung account and was wondering if I can switch it to my main account. Is that possible? I tried searching here but with no avail"
2024-01-21T11:25:41Z,Speed and battery life comparison between S24/24+ Exynos and S24 ultra (SD3)
2024-01-21T11:23:18Z,Do you think the s23 ultra will drop in price by November?
2024-01-21T11:15:38Z,Which color S24 will show the least amount of fingerprints and scratches.
2024-01-21T10:51:18Z,Disappointing battery life for S24+ Exynos vs S24 Ultra (SD3)
2024-01-21T10:39:43Z,10 Samsung Galaxy S24 Ultra Cases &amp; Accessories You Must Have
2024-01-21T10:39:29Z,10 Samsung Galaxy S24 Ultra Cases &amp; Accessories You Must Have
2024-01-21T10:39:29Z,10 Samsung Galaxy S24 Ultra Cases &amp; Accessories You Must Have
2024-01-21T09:56:20Z,S24 Ultra: Glass vs Plastic Screen Protector?
2024-01-21T09:53:46Z,Which phone I should choose?
2024-01-21T09:39:47Z,Camera lens protectors
2024-01-21T09:02:57Z,Camera Assistant gets updated to support Galaxy S24 camera features - SamMobile
2024-01-21T08:51:36Z,Exynos 2400 thermals
2024-01-21T08:06:41Z,Benchmarks + battery life comparison | Samsung Galaxy S24 series
2024-01-21T07:48:29Z,Possibly jumping to Samsung
2024-01-21T07:48:29Z,Possibly jumping to Samsung
2024-01-21T06:54:39Z,"Samsung Galaxy S24 Ultra shines in battery life test, narrowly beats iPhone 15 Pro Max and Pixel 8 Pro to reclaim battery crown"
2024-01-21T06:48:37Z,Samsung US support stole my cart...🤑🤢
2024-01-21T06:34:55Z,S23U to S24U
2024-01-21T06:27:39Z,What to do after switching?
2024-01-21T06:21:02Z,S23U to S24U?
2024-01-21T06:08:41Z,Upgrade from S21FE Exynos with vertical lines?
2024-01-21T05:55:27Z,Screen recording quality
2024-01-21T05:38:00Z,Does the retail S24 Ultra have side films preinstalled?
2024-01-21T05:37:02Z,Should I upgrade?
2024-01-21T05:23:40Z,"I drop my phone a lot. Like a really lot. I am clumsy. Looking for advice about a case, but I've only one criteria, I solely and only want the most drop protective case. I couldn't care less about anything else price looks none of it matters."
2024-01-21T04:30:37Z,Upgrade from S21U to S23+?
2024-01-21T04:14:14Z,What Samsung phone do you own?
2024-01-21T03:45:08Z,Galaxy AI trickling down
2024-01-21T02:53:34Z,S23+ to S24+
2024-01-21T02:41:07Z,"My Delivery Date says ""Arrives before official release on 25/01/2024"", isn't it odd that it'd arrive before official release? Must just be a mistake.."
2024-01-21T02:41:07Z,"My Delivery Date says ""Arrives before official release on 25/01/2024"", isn't it odd that it'd arrive before official release? Must just be a mistake.."
2024-01-21T02:40:19Z,"Hello Everyone, I just recently upgraded to the Galaxy S23 (base version- not Ultra), and currently have a Otterbox Defender Pro case on it. However, it started to tear at the bottom where the charger port cover is. I would like to know what everyone's recommendations are. Thank you!"
2024-01-21T02:26:13Z,Trade in eligibility
2024-01-21T02:21:50Z,S22 Ultra battery drain?
2024-01-21T01:59:17Z,Switch from iphone to samsung
2024-01-21T01:50:36Z,S24 ultra (SD3) still smokes the S24+ Exynos version
2024-01-21T01:49:18Z,I have an S21+ and honestly I'm just trying to decide if it's worth it to upgrade to the S24+. 🥹 I haven't yet found a post here discussing this jump.
2024-01-21T01:42:05Z,Is it worth upgrading from s21 ultra to s24 ultra?
2024-01-21T01:31:19Z,Are there too many polls on this sub all of a sudden?
2024-01-21T01:27:43Z,SAMSUNG CANADA NEED HELP
2024-01-21T01:12:35Z,"Anybody know what settings to use to connect Sonos amp to my Samsung TV, such that I can play my Sky TV (UK) audio through it"
2024-01-21T00:44:36Z,Timing of Delivery
2024-01-21T00:34:37Z,How do I click on allow when pairing a device to Samsung tv
2024-01-21T00:31:48Z,Samsung to charge for AI after 2025!?
2024-01-21T00:14:11Z,Will a phone with a cracked screen and a Blackspot be accepted when trading in for s24 ultra?
2024-01-21T00:03:14Z,I can't believe I am saying this but Exynos 2400 is actually great.
2024-01-20T23:48:47Z,Considering a battery replacement for my Samsung S21+. Seeking advice on whether it's worth it. Any insights?
2024-01-20T23:37:56Z,Is a factory reset possible with a Black Death screen?
2024-01-20T23:34:26Z,5% off usa. ref-raz1rj
2024-01-20T23:22:07Z,Hue sync on QE65Q83B TV
2024-01-20T22:55:19Z,Charging with power saving enable
2024-01-20T22:47:06Z,NL tech comparison. Exynos battery life looks really good!
2024-01-20T22:39:11Z,Exynos 2400 vs SD 8 Gen3 (Benchmarks+Battery)
2024-01-20T22:36:33Z,S22 Ultra - Help - Latest OS - any way to get media controls on lock screen WITHOUT having to click clock??
2024-01-20T22:33:22Z,Should I get an S24 within six months if I currently have an S23?
2024-01-20T22:27:11Z,Can I get the new remote for a older tv
2024-01-20T22:19:19Z,Are there new Galaxy Buds Pro coming too?
2024-01-20T21:37:50Z,Explode…?
2024-01-20T21:34:17Z,Samsung TV making me accept the same privacy policy every single time I use it
2024-01-20T21:23:11Z,Article in the Times on the translation AI
2024-01-20T21:09:00Z,Do Coupon Codes From Samsung Work with Rakuten Cashback When Preordering the S24+? ($25 Coupon From Samsung Shop App Signing up for Emails)
2024-01-28T23:56:45Z,S21 Plust to S24 Ultra
2024-01-28T23:55:19Z,S21 Plus to S24 Ultra
2024-01-28T23:50:18Z,Samsung calendar widget showing past events
2024-01-28T23:43:26Z,Worth upgrading to S24U?
2024-01-28T23:35:58Z,Please help
2024-01-28T23:35:57Z,S24 Ultra notification noise when you shut the phone off.
2024-01-28T23:22:41Z,Is it possible to repair?
2024-01-28T23:21:20Z,S9 tablet concerns
2024-01-28T23:06:14Z,Guys i think there is something wrong with my S10
2024-01-28T23:05:25Z,Found Galaxy S7
2024-01-28T22:59:14Z,Advice or suggestions
2024-01-28T22:51:17Z,No Wi-Fi link speed?
2024-01-28T22:44:59Z,Need Help...
2024-01-28T22:44:59Z,Need Help...
2024-01-28T22:43:35Z,Samsung s24 Ultra
2024-01-28T22:40:31Z,Does anyone know if the voice focus on s24 will work on earbuds like iPhones voice isolation
2024-01-28T22:21:57Z,"Help Deciding Between S24, S24 PLUS, and S24 Ultra for College"
2024-01-28T22:21:57Z,"Help Deciding Between S24, S24 PLUS, and S24 Ultra for College"
2024-01-28T22:07:20Z,S24 Keyboard Missing Microphone
2024-01-28T22:07:20Z,S24 Keyboard Missing Microphone
2024-01-28T22:04:04Z,My photos disappeared after I deleted them from my old device (Smart Switch)
2024-01-28T21:59:00Z,Rooting / Jail breaking a12
2024-01-28T21:51:26Z,Anyway to get Hulu Live TV to automatically turn on when I turn on my Samsung smart tv?
2024-01-28T21:49:24Z,s10+ to s24+
2024-01-28T21:43:20Z,Galaxy s22 to Galaxy s24(Sd)
2024-01-28T21:32:24Z,"My S9+ tablet keeps randomly locking, does anyone know how to fix it?"
2024-01-28T21:26:47Z,Work Phone for Network engineer
2024-01-28T21:25:34Z,S-Pen Compatibility
2024-01-28T21:13:58Z,S24 Ultra from S21? Worth it? Sell it to me :)
2024-01-28T21:11:16Z,QE75QN90c vs QE75Q80c
2024-01-28T21:04:18Z,A31 and M31
2024-01-28T21:03:37Z,Samsung Firmware
2024-01-28T21:02:06Z,Unlock a phone without factory reset
2024-01-28T20:57:26Z,A31
2024-01-28T20:55:23Z,S22 Ultra speaker is broken
2024-01-28T20:55:23Z,S22 Ultra speaker is broken
2024-01-28T20:32:10Z,MagSafe Accessories Causing S Pen Issues For S24 Ultra
2024-01-28T20:25:25Z,S24 Ultra Video Recording Settings
2024-01-28T20:24:06Z,How do I transfer my dad's old Iphone whatsapp to his new Samsung S23? They keep logging out of each other!
2024-01-28T20:19:28Z,Gear S3 watch not supported on 2024+ phones.
2024-01-28T20:12:42Z,"£30 free Store credit for s24 pre-order, what's worth getting?"
2024-01-28T20:08:45Z,S24 Ultra Display is gorgeous
2024-01-28T20:06:54Z,Samsung Smart Switch question
2024-01-28T20:02:20Z,Samsung s23 ultra or s24 plus
2024-01-28T20:00:02Z,Looking for a 100$ voucher for Samsung Canada to buy a S24+. Anyone got one they could spare?
2024-01-28T19:54:49Z,"How do you utilize ""Google"" instead of ""Samsung"" for translation on new S24 series?"
2024-01-28T19:46:06Z,UK referral code?
2024-01-28T19:46:06Z,UK referral code?
2024-01-28T19:44:25Z,Samsung S24 vs Pixel 4a vs iPhone 15 camera
2024-01-28T19:44:09Z,Extremely disappointed in the S24+.
2024-01-28T19:42:52Z,3 dots are appering while screen is turning on S24+
2024-01-28T19:39:08Z,Where can I buy a full replacement camera stack for the Galaxy S23+?
2024-01-28T19:36:04Z,Bad Experience with the S24 Ultra
2024-01-28T19:35:47Z,So I was curious and took apart the hinge of the Zflip 5 to see what it does. Thought I'd share my findings.
2024-01-28T19:27:37Z,How to fix emails disappearing after a week
2024-01-28T19:26:28Z,S24 ultra discount code Ireland?
2024-01-28T19:23:10Z,Good keyboard?
2024-01-28T19:16:22Z,Anyone Else's Order Get Delayed?
2024-01-28T19:12:35Z,S21 - No SIM / no network randomly
2024-01-28T18:57:04Z,Looking for a clear backplate for A13 5g
2024-01-28T18:42:28Z,How to enable Pause USB PD on S23
2024-01-28T18:38:47Z,S23 Ultra or base S24?
2024-01-28T18:34:26Z,My [Samsung A33 5G]'s Wi-Fi disconnects and can't find network
2024-01-28T18:30:11Z,"Need to keep pairing and unpair Bluetooth keyboard for tab s9 but not for tab s7, need help pls"
2024-01-28T18:28:41Z,S24U and watch combo / trade in sale?
2024-01-28T18:27:11Z,How to disable phone disconnecting from computer (USB) after some time?
2024-01-28T18:23:42Z,"S24 Utra, Gboard doesn't work in other languages (ex French)"
2024-01-28T18:19:00Z,Anyone else not got their s24 yet?
2024-01-28T18:15:28Z,"""Moisture detected"" warning only when I'm not charging the phone(!)"
2024-01-28T18:10:34Z,"Bluetooth keyboard works on tab s7 but not tab s9, need help pls"
2024-01-28T18:10:34Z,"Bluetooth keyboard works on tab s7 but not tab s9, need help pls"
2024-01-28T18:03:22Z,"People with S24 series, did any of you receive promised OS update?"
2024-01-28T18:02:28Z,Has Anyone Tested the Backup Calling Feature on the Galaxy S24 Series with a Second (e)SIM Is in Roaming?
2024-01-28T18:01:02Z,Has Anyone Tested the Backup Calling Feature on the Galaxy S24 Series with a Second (e)SIM Is in Roaming?
2024-01-28T17:59:12Z,Go Naked or Put a Case On It?
2024-01-28T17:42:55Z,SAMSUNG SHOP RETURNS
