Time Data,Headline
2024-08-11T16:59:52Z,Samsung Galaxy S2 in 2024: Is it even usable at ALL?
2024-08-11T16:52:07Z,S23+ vs S24 Snapdragon?
2024-08-11T16:41:23Z,Ring diameter
2024-08-11T16:23:12Z,S24 ultra inside charging port moving?
2024-08-11T16:13:33Z,One way to improve fold
2024-08-11T16:13:33Z,One way to improve fold
2024-08-11T15:52:28Z,Calories burned while sleeping
2024-08-11T15:50:56Z,iPhone 14 Pro vs Samsung S24 ultra
2024-08-11T15:46:23Z,secure folder gallery vs. gallery
2024-08-11T15:45:50Z,"Galaxy Watch Ultra Day 12, just another smartwatch by Samsung or...?"
2024-08-11T15:38:03Z,Does the new Samsung A55 5G is good for gaming?
2024-08-11T15:33:10Z,traditonal gestures on S24 ultra 
2024-08-11T15:31:52Z,Does the Samsung A55 5G is good for gaming?
2024-08-11T15:17:41Z,Question about browser history.
2024-08-11T14:46:29Z,7 Bluetooth vs ultra cellular
2024-08-11T14:05:43Z,Samsung UK. Do they accept network locked phones for trade in?
2024-08-11T13:55:08Z,Samsung A15 wifi calling probs solved
2024-08-11T13:34:19Z,Don't know what phone to get
2024-08-11T13:31:56Z,S24 ? Or other ?
2024-08-11T13:29:37Z,Is the phone case of Samsung A15 5G &amp; Samsung A25 5G the same?
2024-08-11T13:24:48Z,Samsung Galaxy Book 3
2024-08-11T12:56:47Z,Where can I get this theme in Samsung?
2024-08-11T12:50:19Z,How to add esim on S24 Ultra from Hong Kong
2024-08-11T12:42:44Z,Cheapest samsung tab with oled panel? 
2024-08-11T12:31:49Z,Samsung s23 and s23plus size
2024-08-11T12:24:48Z,Samsung Account Login Issues
2024-08-11T11:07:11Z,S24 512gb.. available in what countries?
2024-08-11T10:45:07Z,Samsung s24
2024-08-11T10:01:22Z,"Daily Support Thread | August 11, 2024"
2024-08-11T10:00:57Z,Found the perfect small tab active 5. Does it support good lock?
2024-08-11T09:59:53Z,Do I need Ram plus?
2024-08-11T09:59:25Z,Changing the last CSC
2024-08-11T09:48:12Z,Astrophotography settings
2024-08-11T09:43:12Z,Does anyone know why my tv screen is gapped at the top?
2024-08-11T09:25:26Z,How Can I Recover a Lost Video Preview from My Google Nest Doorbell Notification?
2024-08-11T09:15:03Z,All roads led me to Galaxy 
2024-08-11T09:12:40Z,In-ecosystem buds switching is weird 
2024-08-11T08:57:26Z,"Which One to Buy, Watch 6 Cla*ssic or Watch 7?"
2024-08-11T08:38:19Z,Samsung health keep trying to use Bluetooth
2024-08-11T08:33:42Z,Need Help! - Service Center Denying to Service my Phone.
2024-08-11T08:33:42Z,Need Help! - Service Center Denying to Service my Phone.
2024-08-11T08:20:57Z,Should I buy s23 ultra or s24 ultra in August 2024 
2024-08-11T08:09:15Z,There is no smaller size Ultra from Samsung and I'm thinking about the competition
2024-08-11T07:58:43Z,Samsung Galaxy A15 - No Chinese Handwriting Keyboard?
2024-08-18T23:48:20Z,Autocorrect does this on every Samsung phone I have. Why??
2024-08-18T23:48:20Z,Autocorrect does this on every Samsung phone I have. Why??
2024-08-18T23:46:27Z,Samsung to Bose Soundbar 
2024-08-18T23:41:31Z,Neo QLED QN90C picture issues
2024-08-18T23:33:27Z,My screen got fliped 
2024-08-18T22:55:49Z,I would like to change my A23
2024-08-18T22:19:59Z,Is the S24U better?
2024-08-18T21:46:35Z,Samsung A14 Power Issues
2024-08-18T21:46:35Z,Samsung A14 Power Issues
2024-08-18T21:42:46Z,Having an audio glitch on s22 
2024-08-18T21:41:13Z,2 Phones 1 Case
2024-08-18T21:17:17Z,Samsung F13 lock screen not lighting up when receiving notifications
2024-08-18T21:17:17Z,Samsung F13 lock screen not lighting up when receiving notifications
2024-08-18T21:10:51Z,Samsung has launched its latest budget-friendly smartphone- Samsung Galaxy A06
2024-08-18T20:46:02Z,S24 Ultra screen on time
2024-08-18T20:41:48Z,Switching from my iPhone to Samsung 
2024-08-18T20:38:26Z,Q80c game mode mini map share
2024-08-18T20:37:19Z,considering switching from iphone 12 pro to samsung.. thoughts?
2024-08-18T20:37:07Z,WhatsApp using too much space on s23
2024-08-18T20:33:46Z,samsung odyssey g70b speaker specs?
2024-08-18T20:33:46Z,samsung odyssey g70b speaker specs?
2024-08-18T20:29:06Z,is there a way similar to the modes that does a complete overhaul of the phone?
2024-08-18T20:28:00Z,Conflicted between S24Ultra or wait for S25Ultra to drop ?
2024-08-18T20:26:48Z,"Dear Samsung, for S25 Ultra make black color much darker and make titanium silver the same shade as buds 3 pro without the yellowish tint"
2024-08-18T20:24:07Z,Trying to better understand the phone. 
2024-08-18T20:11:25Z,Moon with my s21 5G
2024-08-18T19:50:21Z,Annoying things from Samsung.
2024-08-18T19:24:15Z,S22 Ultra screen issue
2024-08-18T19:21:27Z,Inca Kola with S24 Ultra 
2024-08-18T19:03:52Z,Best charger to charge watch and phone at max charging speeds? (2 USB C ports)
2024-08-18T18:47:37Z,Light on the side of the screen s23 ultra
2024-08-18T18:47:14Z,Light on the side of the screen s23 ultra
2024-08-18T18:42:52Z,S24 battery?
2024-08-18T18:42:52Z,S24 battery?
2024-08-18T18:34:29Z,Golden ratio grid on S24 camera?
2024-08-18T18:27:55Z,Is there something (third-party) for the S24 like the smart view case but with a magnet? 
2024-08-18T18:12:33Z,My Odyssey OLED came with this part. No idea for its use.
2024-08-18T18:09:33Z,Dilemma
2024-08-18T17:52:58Z,Yea
2024-08-18T17:52:33Z,Dilemma
2024-08-18T17:35:06Z,iPhone 15 Pro -&gt; Z Flip 6 -&gt; S24 Ultra 
2024-08-18T17:30:04Z,"The USBs I use stop working for my phone, but work for other phones?"
2024-08-18T17:28:07Z,Buds 3 Pro Shipping Date
2024-08-18T17:18:40Z,Question about the s pen
2024-08-18T17:06:18Z,remove this space below
2024-08-18T17:05:16Z,can you remove this space below
2024-08-18T17:04:32Z,how ti remove this space below?
2024-08-18T16:58:15Z,Technical Question
2024-08-18T16:56:46Z,How good is the ambient mode on the Buds 3 Pro? 
2024-08-18T16:36:00Z,Should I switch to a Z Flip 6 if Samsung will give me $676 CAD for my S21 Ultra?
2024-08-18T16:33:01Z,S24u battrey drain
2024-08-18T15:59:58Z,My Tab S9 + display kind of sucks....
2024-08-18T15:55:15Z,Display issues on Galaxy Tab S9 +
2024-08-18T15:53:49Z,The new watches colors sucks
2024-08-18T15:45:28Z,Which Samsung phone had the most elegant Camera Bump? 
2024-08-18T15:44:55Z,S22 Ultra Vs Z Flip 5
2024-08-18T15:42:52Z,Steal my favorite❤️🔥
2024-08-18T15:42:52Z,Steal my favorite❤️🔥
2024-08-18T15:40:29Z,s24 512gb ultra at 600€ on Amazon IT marketplace?
2024-08-18T15:35:42Z,S24 Ultra or Pixel Pro 9 XL? 
2024-08-18T15:34:22Z,Galaxy S24 Ultra
2024-08-18T15:33:49Z,Samsung monitor for xbox series x flashing half/half black and white??
2024-08-18T15:14:34Z,A55: gps signal lost/not working google maps (works with waze)
2024-08-18T15:12:15Z,I just realized spotify has been downloading this for over a day
2024-08-18T15:08:47Z,How do I change my default asistant app to Google Asistant instead of the Google App?
2024-08-18T15:05:55Z,How to buy a *really* new S23 Ultra in France
2024-08-18T15:02:54Z,Samsung clock alarm not showing remaining time
2024-08-18T15:00:57Z,S23 FE or A55 as basic user?
2024-08-18T15:00:49Z,Samsung clock alarm not showing remaining time
2024-08-18T14:50:37Z,How to prevent S Pen from scrolling while drawing?
2024-08-18T14:20:53Z,Redirect back to app 
2024-08-18T14:16:34Z,"Has anyone tried the Circle to Search feature in the beta version of Google's app? If so, please drop a video. It is said that there is a music recognition function for the device's surroundings and what is on the screen (multimedia)."
2024-08-18T14:15:51Z,S24 Ultra issues
2024-08-18T14:03:12Z,Bluetooth Mouse Slim SN?
2024-08-18T14:03:12Z,Bluetooth Mouse Slim SN?
2024-08-18T14:02:39Z,s23 ultra vs s24+
2024-08-18T13:58:09Z,Should I get the Book 4 edge?
2024-08-18T13:52:03Z,Updates every f'ing day. 
2024-08-18T13:43:03Z,Browser Poll
2024-08-18T13:20:40Z,A35 instead of a55
2024-08-18T12:18:06Z,"Samsung A52 : Humidity problem, damn bug

"
2024-08-18T11:39:21Z,Have the S24U issues been resolved? 
2024-08-18T10:45:15Z,S24 Ultra's screen is worst than from my Poco F4 GT?
2024-08-18T10:36:54Z,Is it smart to switch from s21 ultra to a normal s22 ?? 
2024-08-18T10:30:13Z,Is Samsung GalaxyFit Watch has the same sleeping tracker capability with Samsung Ring?
2024-08-18T10:23:23Z,Is s21+/s21 still a good option in 2024?
2024-08-18T10:08:19Z,How long does a ‘cancellation request’ take for the order to actually be cancelled 
2024-08-18T10:01:42Z,Question unrelated to post: does anyone know what font this is?
2024-08-18T10:01:42Z,Question unrelated to post: does anyone know what font this is?
2024-08-18T10:01:27Z,"Daily Support Thread | August 18, 2024"
2024-08-18T10:01:12Z,Safely dispose TV
2024-08-18T08:49:07Z,Recommend me all settings you know to make my Galaxy phone last as many years as possible
2024-08-18T08:39:43Z,A54 False Overheating
2024-08-18T08:38:41Z,Just came from iPhone. I have 2 werks to decide wether I keep the s24 ultra or not. What are your tips and tricks to improve the experience Samsung doesn't tell me about?
2024-08-18T08:37:20Z,A54 False Overheating
2024-08-18T08:37:20Z,A54 False Overheating
2024-08-18T08:36:46Z,A54 False Overheating
2024-08-18T08:36:46Z,A54 False Overheating
2024-08-18T08:34:57Z,Thinking of getting a Samsung (IPhone user)
2024-08-18T08:30:02Z,S24 ultra astrophoto capture time
2024-08-25T23:57:06Z,Samsung Galaxy A54 USB Port Detection 
2024-08-25T23:36:29Z,How does the s24 ultra camera compare to the z flip 6?
2024-08-25T23:21:11Z,what to do
2024-08-25T22:57:20Z,I'll never understand why people buy a new S24/+ when they can have this beast for a fraction of the price
2024-08-25T22:52:01Z,This is my battery life. Is it good? Also I have a Galaxy S21 FE.
2024-08-25T22:39:01Z,Rant: Mic filter is not good
2024-08-25T22:09:44Z,What the heck is this Samsung USB device?
2024-08-25T22:08:02Z,Which magsafe cases don't affect the S-Pen for the s24 ultra?
2024-08-25T22:02:13Z,Screen Protector for Galaxy S24.
2024-08-25T22:00:29Z,Samsung Boost Freebies - Have they gone?
2024-08-25T22:00:08Z,I have a Galaxy A51 since 2019 and been meaning to upgrade. Need some advice
2024-08-25T21:34:13Z,Samsung SSD T7 regular vs Touch encryption cross devices
2024-08-25T21:34:01Z,S24 Ultra after S25 Note/Ultra release
2024-08-25T21:21:56Z,S23FE Image Retention
2024-08-25T21:16:10Z,What font/theme is this?
2024-08-25T21:05:16Z,A55 5G 256GB
2024-08-25T21:00:23Z,Dex Mode For Drawing… Awesome!
2024-08-25T20:50:48Z,Tab s9 plus with att
2024-08-25T20:50:48Z,Tab s9 plus with att
2024-08-25T20:40:54Z,"base s24, button issues?"
2024-08-25T20:40:23Z,Is there a way to remove this message? (Samsung Galaxy S25 Ultra)
2024-08-25T20:29:39Z,S24 Ultra refuses to access samsung account
2024-08-25T20:17:37Z,Samsung Galaxy Tab Active5 5G opinion
2024-08-25T20:17:00Z,S20 FE vs A55
2024-08-25T20:06:42Z,Is the A55 a good phone for an average user?
2024-08-25T20:05:15Z,"How do I protect my privacy and data while traveling? (Customs, theft, etc)"
2024-08-25T19:54:51Z,Adaptive battery feature 
2024-08-25T19:48:31Z,What is this blue bar at the bottom of my s21 when im gaming? 
2024-08-25T19:47:49Z,Is there a way to set a specific word to be auto replaced?
2024-08-25T19:35:49Z,Help
2024-08-25T19:29:48Z,"Bought a Pixel 9 Pro XL today, and will try to use it as my daily driver for the next 2 weeks to compare to the s24 Ultra Ihave been using since launch."
2024-08-25T19:29:48Z,"Bought a Pixel 9 Pro XL today, and will try to use it as my daily driver for the next 2 weeks to compare to the s24 Ultra Ihave been using since launch."
2024-08-25T19:03:10Z,Samsung 95SD ultrawide €1350
2024-08-25T18:55:18Z,Good?
2024-08-25T18:53:04Z,Is this fixable or preventable? 
2024-08-25T18:51:40Z,A55 / S23
2024-08-25T18:41:43Z,Is it worth exchanging the S23+ for the S24+?
2024-08-25T18:41:43Z,Is it worth exchanging the S23+ for the S24+?
2024-08-25T18:39:55Z,Is it worth exchanging the S23+ for the S24+?
2024-08-25T18:39:13Z,Is it worth exchanging the S23+ for the S24+?
2024-08-25T18:39:13Z,Is it worth exchanging the S23+ for the S24+?
2024-08-25T18:35:31Z,Is the s23 worth double that of the a55
2024-08-25T18:35:31Z,Is the s23 worth double that of the a55
2024-08-25T17:49:36Z,Samsung vs other Chinese smart phones (battery topic)
2024-08-25T17:41:50Z,I’m getting offered a z flip6 512 Gb new with galaxy buds pro 3 for 999 should I buy it or wait for Labor Day discount?
2024-08-25T17:27:08Z,Frame compatible wall mount with 4 inch gap
2024-08-25T17:20:20Z,A Proud Samsung Knight 🗡️!
2024-08-25T17:13:49Z,Can't send messages to IPhone users (Google Messenger)
2024-08-25T17:07:02Z,"A problem with A series phones, A35 specifically or it's just bad luck?"
2024-08-25T16:49:33Z,"How is your battery drain?
"
2024-08-25T16:43:01Z,Have you ever wondered why AMOLED panels are so fragile ? Here's why.
2024-08-25T16:22:50Z,i know what cpu the samsung preston has
2024-08-25T16:22:50Z,i know what cpu the samsung preston has
2024-08-25T16:19:29Z,"Trouble with Galaxy A71, screen not turning on."
2024-08-25T16:19:29Z,"Trouble with Galaxy A71, screen not turning on."
2024-08-25T15:58:58Z,Is this real
2024-08-25T15:36:18Z,Does anyone know around how much the z flips go in sale for Labor Day ?
2024-08-25T15:35:24Z,Connect samsung tv to WiFi without remote
2024-08-25T15:18:19Z,Help me choose a Samsung Galaxy for longevity 
2024-08-25T15:15:50Z,Google photos and Samsung Galaxy sync
2024-08-25T15:11:15Z,"""My name is using the Samsung Z Fold 6."""
2024-08-25T15:06:04Z,"Samsung keyboard is breaking my phone!!! Posting here since this is bigger, dont know if it fits :("
2024-08-25T14:56:12Z,Love my galaxy 24s plus but one problem no one seems to help with
2024-08-25T14:53:49Z,Help choose s pen custom sound
2024-08-25T14:52:59Z,Apple music not working 
2024-08-25T14:52:59Z,Apple music not working 
2024-08-25T14:48:33Z,Why do Samsung phones not have the battery life option like iPhone?
2024-08-25T14:38:06Z,GEMINI With Samsung
2024-08-25T14:33:59Z,s24 GPS issues? 
2024-08-25T14:11:45Z,Should I purchase a base variant s24 Exynos 
2024-08-25T13:28:34Z,Is there an app that changes how i turn on my phone?
2024-08-25T13:17:21Z,"What does that dot mean, i tried googling it and i couldn't find anything, im on Galaxy S8"
2024-08-25T13:16:28Z,Does Samsung Ultra 21 have issues shooting at night at UHD 60 fps?
2024-08-25T13:09:31Z,S24 Exynos opinion
2024-08-25T12:30:19Z,"Hello I'm looking for an advice, I'm choosing between s21 ultra exynos and note 20 ultra snapdragon and I'm gonna do fair bit of gaming so what do you recommend. I'm also looking for a good camera so which one is better? Btw found them for the same price. ?"
2024-08-25T12:28:48Z,"Hello I'm looking for an advice, I'm choosing between s21 ultra exynos and note 20 ultra snapdragon and I'm gonna do fair bit of gaming so what do you recommend. I'm also looking for a good camera so which one is better? Btw found them for the same price."
2024-08-25T12:24:48Z,Looking to upgrade to bigger phone. Good deal?
2024-08-25T12:18:41Z,My screen is bugged
2024-08-25T12:06:45Z,"My s21 glitched and google had 1 tab open but said 7, had a random russian word in the search bar, and at some point the letters were random on the keyboard, its fixed after restarting"
2024-08-25T11:51:58Z,Is it worth exchanging the S23+ for the S24+?
2024-08-25T11:51:58Z,Is it worth exchanging the S23+ for the S24+?
2024-08-25T11:07:21Z,Samsung S6 Lite pen nib replacement
2024-08-25T10:38:19Z,A simple touch screen lock for my phone?
2024-08-25T10:20:58Z,pros and cons of samsung book 4
2024-08-25T10:05:02Z,Is the s24 ultra worth it if we don't count any of the ai features that'll be subscription only soon?
2024-08-25T10:01:43Z,"Daily Support Thread | August 25, 2024"
2024-08-25T09:36:26Z,New phone - transfer wallet
2024-08-25T09:36:01Z,Galaxy buds 2 pro update ruins noise cancellation
2024-08-25T09:28:18Z,Media pausing on every app?
2024-08-25T08:51:22Z,Is the european base S24 (8gb/256gb) worth it?
2024-08-25T08:50:36Z,Switching from Samsung to Apple
2024-08-25T08:46:39Z,Pro mode or expert raw?
2024-08-25T08:29:58Z,"People who switched from ultra to fold, would you recommend fold?"
2024-08-25T07:50:15Z,Is going from a S20 to an A55 a downgrade?
2024-08-25T07:50:04Z,Insane S24 Exynos Battery Drain
2024-08-25T07:48:03Z,S24 in T-mobile
2024-08-25T07:37:44Z,S24: Only one camera (?)
2024-08-25T07:20:11Z,Long term(kind of??) review of the Samsung Galaxy Buds 3 Pro
2024-08-25T07:08:00Z,S24 Ultra Hurts
2024-08-25T06:48:49Z,Anyone using this phone in 2024? Do you have any of the issues that I encounter?
2024-09-01T23:55:37Z,Has anyone else had the issue where it sounds like you're underground on phone calls?
2024-09-01T23:37:01Z,My samsung galaxy s21 cannot detect my sim card
2024-09-01T23:16:27Z,Samsung charger water damage
2024-09-01T23:12:47Z,Samsung zflip6 zfold6 discount code
2024-09-01T22:54:42Z,Delays Making Me Double Guess
2024-09-01T22:24:40Z,Galaxy Book3 Ultra repair
2024-09-01T22:20:26Z,How to enable Perf Z anywhere?
2024-09-01T22:16:33Z,Samsung insurance 
2024-09-01T22:10:53Z,The new Samsung Galaxy S24 Ultra ! (Coming 20 years ago)
2024-09-01T22:10:53Z,The new Samsung Galaxy S24 Ultra ! (Coming 20 years ago)
2024-09-01T22:09:28Z,Static noiss
2024-09-01T22:09:28Z,Static noiss
2024-09-01T22:05:15Z,Some apps not working
2024-09-01T21:55:48Z,Pixel 9 Pro XL vs Galaxy S24 Ultra vs iPhone 15 Pro Max Camera Test (DayTime)
2024-09-01T21:51:10Z,Tablet Recommendation 
2024-09-01T21:32:49Z,Struggling to Choose the Right Phone for Long-Term Use
2024-09-01T21:28:59Z,"65"" tv Q70DA or Q72DD"
2024-09-01T21:24:50Z,"Newest Update at its finest... WiFi not working, UI BUGGED"
2024-09-01T21:24:50Z,"Newest Update at its finest... WiFi not working, UI BUGGED"
2024-09-01T21:09:19Z,A55 ATT
2024-09-01T20:49:40Z,Someone explain how to fix this?
2024-09-01T20:38:30Z,Does the vibration intensity on a phone go down over time?
2024-09-01T20:28:18Z,AI rewriting is too sensitive
2024-09-01T20:28:04Z,Is it necessary to calibrate Samsung front load 4.5 cu.ft washing machine?
2024-09-01T20:27:04Z,Is there a way to change the wallpaper for each tab ?
2024-09-01T20:27:04Z,Is there a way to change the wallpaper for each tab ?
2024-09-01T20:25:12Z,When did Samsung change the Galaxy S names to be the year?
2024-09-01T20:15:23Z,Does S23 ultra have dual cell battery?
2024-09-01T19:59:16Z,Is this used or unused data ?
2024-09-01T19:52:53Z,How do I remove this light bar? Never seen it before. Thanks 
2024-09-01T19:52:53Z,How do I remove this light bar? Never seen it before. Thanks 
2024-09-01T19:39:47Z,Is there a way to have videos from my camera app get saved directly into a plugged in external hard drive?
2024-09-01T19:14:26Z,S24 vs S23 
2024-09-01T19:05:40Z,Activity in folder but nothing is downloaded
2024-09-01T19:05:40Z,Activity in folder but nothing is downloaded
2024-09-01T18:56:57Z,$200-$300 phone? 
2024-09-01T18:50:30Z,Frame TV One Connect Box
2024-09-01T18:18:09Z,"Just upgraded from S21 to S24, what is this line that appears in whatsapp?"
2024-09-01T18:12:27Z,Samsung soundbar (Q950a) doesn't connect to alexa services
2024-09-01T18:06:45Z,Upgrading from four year old a71 to s24. Which accessories do you recommend?
2024-09-01T18:06:45Z,Upgrading from four year old a71 to s24. Which accessories do you recommend?
2024-09-01T18:06:20Z,Not able to copy or delete files from my new Samsung SSD T7
2024-09-01T18:04:38Z,Google maps routes not working
2024-09-01T18:01:29Z,Was this a good deal?
2024-09-01T17:32:36Z,"6 months after my father used his S24U, it just broke while trying to charge it"
2024-09-01T17:28:19Z,Samsung range error code 
2024-09-01T17:24:49Z,Shit Samsung TV
2024-09-01T17:24:49Z,Shit Samsung TV
2024-09-01T17:13:30Z,E-sim for my Galaxy S23 travel to Portugal 
2024-09-01T17:02:29Z,Broken Screen Z Flip 3 
2024-09-01T16:53:04Z,Preventing accidental 911 calls on S20 FE?
2024-09-01T16:26:43Z,any way to move this music thing lower on lock screen?
2024-09-01T16:26:43Z,any way to move this music thing lower on lock screen?
2024-09-01T16:17:16Z,Frustrated with the Samsung's My Files Search Functionality
2024-09-01T16:12:39Z,Frustrated with the Samsung's My Files Search Functionality
2024-09-01T16:12:39Z,Frustrated with the Samsung's My Files Search Functionality
2024-09-01T16:10:19Z,Just picked up an s22 ultra! My first Samsung phone.
2024-09-01T16:04:57Z,"What charger should I buy for my S24, and will my current Huawei charger damage the phone?"
2024-09-01T15:50:29Z,HI Everyone i need some help with my GT-B7722 (its not an S model) 
2024-09-01T15:48:20Z,Worth the import?
2024-09-01T15:43:37Z,Does the Anker Nano 2 65W GaN PPS charger support Super Fast Charging 2.0 for the S24U/Plus?
2024-09-01T15:43:37Z,Does the Anker Nano 2 65W GaN PPS charger support Super Fast Charging 2.0 for the S24U/Plus?
2024-09-01T15:29:29Z,Troca de bateria
2024-09-01T15:12:20Z,S20Fe or S21+?
2024-09-01T15:06:11Z,Similar to S24+ but with headphone jack?
2024-09-01T14:54:45Z,Anker Nano 2 65W GaN PPS Charger compatibility with S24 Ultra.
2024-09-01T14:54:45Z,Anker Nano 2 65W GaN PPS Charger compatibility with S24 Ultra.
2024-09-01T14:49:48Z,Need Help uploading font to Samsung Store
2024-09-01T14:45:46Z,S21 FE (snapdragon 888) (refurbished) for €200
2024-09-01T14:44:05Z,how to allow volume up and down keys on lock screen android 14
2024-09-01T14:43:22Z,S20+ to Zfold 5 
2024-09-01T14:38:56Z,I'm dissapointed in Samsung this year
2024-09-01T14:38:51Z,Z Fold 5 not getting OneUI 7?
2024-09-01T14:27:51Z,Not charging properly
2024-09-01T14:16:24Z,Is the S24 base model still worth it after the recent discounts at $825 CAD?
2024-09-01T13:56:36Z,Never got an August update?
2024-09-01T13:37:44Z,How do I search apps from the home button on Samsung s24+?
2024-09-01T13:21:07Z,What phones whether Samsung or not are bigger than the A13 but not foldable.
2024-09-01T12:46:54Z,S10+ user looking for upgrades!
2024-09-01T12:40:32Z,What does the paper emoji say?
2024-09-01T12:40:32Z,What does the paper emoji say?
2024-09-01T12:20:19Z,Can I put BIOs unlocking on my apps
2024-09-01T12:04:02Z,Update broke phone
2024-09-01T11:07:00Z,HDR10+ video disable or enable?
2024-09-01T11:00:14Z,Legit?
2024-09-01T10:36:03Z,"So not ethical. Plz help. Need advice/instruction. S24u remotely rooted. Yes, really. See photos. "
2024-09-01T10:25:16Z,Ridiculed by Samsungs support and false advertising
2024-09-01T10:15:27Z,Galaxy watch 7 from watch 5
2024-09-01T10:15:27Z,Galaxy watch 7 from watch 5
2024-09-01T10:02:09Z,"Daily Support Thread | September 01, 2024"
2024-09-01T09:48:28Z,Will the silver buds pro3 ever restock in Ireland?
2024-09-01T09:36:41Z,Get your galaxy 
2024-09-01T09:25:04Z,Making calls with AUX in car
2024-09-01T09:21:43Z,What is the photos and videos permission used for on Samsung Internet?
2024-09-01T09:19:38Z,What is the photos and videos permission used for on Samsung Internet?
2024-09-01T08:59:47Z,Any one can recommend one of them? 
2024-09-01T08:59:47Z,Any one can recommend one of them? 
2024-09-01T08:53:32Z,Samsung not sent cashback way past deadline date - what can I do?
2024-09-01T08:40:12Z,How to get rid of samsung health notification on gsw7?
2024-09-01T08:26:17Z,Mic Mode Missing
2024-09-08T23:38:52Z,Galaxy A35 Dead pixel
2024-09-08T23:38:52Z,Galaxy A35 Dead pixel
2024-09-08T23:09:26Z,Samsung TV Price Match Failure
2024-09-08T22:51:21Z,"Does anyone know what's coming on the new Samsung ""One UI 7"" October 7th 2024 ?"
2024-09-08T22:48:29Z,Does One UI core support the new control centre in A05?
2024-09-08T22:44:40Z,Samsung punishing customers due to incompetent support staff
2024-09-08T21:49:53Z,RCS chat
2024-09-08T21:12:46Z,My s24 ultra heating up problems
2024-09-08T21:12:05Z,Here is a comparison of the Samsung Galaxy S FE bezels. 
2024-09-08T21:12:05Z,Here is a comparison of the Samsung Galaxy S FE bezels. 
2024-09-08T21:06:29Z,Case suggestion for s24 ultra
2024-09-08T20:26:20Z,samsung a52
2024-09-08T20:05:27Z,Switch from Xiaomi 11T Pro to S22(QUESTIONS)
2024-09-08T19:22:44Z,Galaxy Book 5
2024-09-08T18:55:46Z,Transition from a Samsung S20 FE 5G to a Samsung A55 5G
2024-09-08T18:50:23Z,Can I schedule TV to require PIN after a certain time?
2024-09-08T18:50:13Z,Samsung Washing Machine 
2024-09-08T18:32:03Z,Galaxy Watch Ultra Won't Connect to Google Fi Mobile Plan
2024-09-08T18:31:16Z,Google apps not working on phone internet but work on wifi
2024-09-08T18:31:16Z,Google apps not working on phone internet but work on wifi
2024-09-08T18:26:06Z,All images and video for this Galaxy A14 appear backwards/mirrored?
2024-09-08T18:20:08Z,"Where do I get a ""claim forum"" to upload? "
2024-09-08T18:20:08Z,"Where do I get a ""claim forum"" to upload? "
2024-09-08T18:16:52Z,Lost phone 
2024-09-08T18:13:55Z,S24 ultra aluminum rings from camera chipped 
2024-09-08T17:59:50Z,Significant battery degradation after last few updates
2024-09-08T17:56:17Z,Thoughts on the icons for upcomingUI 7?
2024-09-08T17:48:48Z,Fold 4 bluetooth physical remote
2024-09-08T17:43:00Z,Google Messages is testing an updated text field for chats
2024-09-08T17:39:17Z,One UI home new version available 
2024-09-08T17:36:25Z,Scratch on ultra wide camera
2024-09-08T17:35:42Z,Scratch on ultra wide camera
2024-09-08T17:35:12Z,Am I Right That Samsung Keyboard is AWFUL? 
2024-09-08T17:09:47Z,Low budget Samsung 
2024-09-08T17:03:48Z,M5 Smart Monitor - Geforce Now Mouse Cursor 
2024-09-08T16:49:38Z,Any way at all to return a lost phone?
2024-09-08T16:30:30Z,S90d only WOLED instead of QD-OLED in Europe?
2024-09-08T16:23:26Z,Switching to iPhone: My Experience and Dilemma
2024-09-08T16:19:05Z,Samsung might have scammed me 
2024-09-08T16:06:26Z,My phone is not that old :(     (note 10 lite)
2024-09-08T16:06:17Z,Smart Switch just screwed me.
2024-09-08T16:04:37Z,TV sound to phone removed?
2024-09-08T15:54:27Z,Meta App Manager
2024-09-08T15:46:32Z,Am I spending too much time on my phone? 
2024-09-08T15:19:50Z,Astrology star photography 
2024-09-08T15:00:12Z,Samsung advertised their phone incorrectly 
2024-09-08T14:56:58Z,Charging issue on Samsung Galaxy S24 Ultra
