Time Data,Headline
2020-05-14T00:00:00Z,"Fiduciary Management Inc Buys Royal Philips NV, Booking Holdings Inc, Comcast Corp, Sells ..."
2020-05-14T14:38:00Z,"Norwegian Cruise CEO: Vast Majority Of Future Bookings Are Normal Cash Bookings, Not Certificates From Cancelled Cruises"
2020-05-15T00:00:00Z,surge rural tourism bookings inquiries south australia
2020-05-15T00:00:00Z,"Lombard Odier Asset Management (USA) Corp Buys Booking Holdings Inc, New Oriental Education ..."
2020-05-15T00:00:00Z,"Fore Capital, LLC Buys Wells Fargo, Bank of America Corp, Booking Holdings Inc, Sells Sprott ..."
2020-05-15T00:00:00Z,"Foyston, Gordon, & Payne Inc Buys Booking Holdings Inc, Starbucks Corp, Zebra Technologies ..."
2020-05-19T00:00:00Z,"REVEALED: Mike Pompeo's lavish, subsidized house in military complex in D.C. after probe into whether he used staffer to walk his dog and make restaurant bookings is stopped by IG's firing"
2020-05-19T04:00:00Z,Southwest says bookings outpace cancellations in May
2020-05-19T11:59:00Z,"United Airlines Holdings Inc In April, Company Experienced Gross Bookings That Were Down Over 95% YoY"
2020-05-19T12:45:00Z,"Southwest Airlines shares are trading higher after the company said it has recently experienced modest improvement in passenger demand, bookings and trip cancellations."
2020-05-19T14:59:00Z,Delta Air Shares Largely Unaffected Following Optimistic Comments From CFO At Wolfe Research Conference; CFO Says Mgmt. Seeing Uptick In Leisure Bookings For Domestic Travel
2020-05-20T00:00:00Z,US Carriers' May Bookings Rise: Can Airlines Bounce Back?
2020-05-20T12:11:00Z,Royal Caribbean Booking Volumes For Remainder Of 2020 Are Meaningfully Lower Than Same Time Last Year At Prices That Are Down Low-Single Digits
2020-05-20T20:04:00Z,"Expedia Group Q1 EPS $(1.830) Misses $(1.040) Estimate, Sales $2.209B Miss $2.290B Estimate, Gross Bookings Down 39% YoY"
2020-05-21T15:31:00Z,"Southwest CEO Says Limiting Bookings On Flights To Allow Social Distancing Through At Least July, Will Add More Flights To Meet Extra Demand"
2020-05-22T00:00:00Z,melbourne restaurants face post coronavirus booking rush
2020-05-27T04:00:00Z,"Ryanair's holiday bookings surge, sees UK dropping quarantine"
2020-05-28T00:00:00Z,"SRS Investment Management, LLC Buys Booking Holdings Inc, Comcast Corp, Palo Alto Networks Inc, ..."
2020-05-28T12:12:00Z,Sabre Says Gross Air Bookings Remain Down ~90% YoY
2020-05-28T20:09:00Z,"Glu Mobile Raises Q2 Bookings Guidance From $150M-$155M To $162.5M-$167.5M, FY20 From $490M-$500M To $502.5M-$512.5M"
2020-05-29T00:00:00Z,"Running Oak Capital LLC Buys Kadant Inc, Maximus Inc, Primerica Inc, Sells Aon PLC, Booking ..."
2020-05-29T04:00:00Z,Uber launches hourly ride booking option in some U.S. cities
2020-05-29T12:10:00Z,Glu Mobile shares are trading higher after the company raised Q2 and FY20 bookings guidance.
2020-05-30T00:00:00Z,holiday camp bookings surge south west australia post lockdown
2020-06-02T00:00:00Z,"Confluence Investment Management Llc Buys Snap-on Inc, Dollar Tree Inc, Booking Holdings Inc, ..."
2020-06-09T13:01:00Z,Allegiant Travel Reports Prelim. Passenger Traffic For May: Averaged $2M+ In Gross Bookings/Day
2020-06-11T00:00:00Z,jetstar bookings sunshine coast from july
2020-06-11T00:00:00Z,The 8 hottest bookings in the summer concert series
2020-06-17T00:00:00Z,Wedding photographer reveals bride canceled her booking and demanded a refund because she supported Black Lives Matter on Instagram - so she donated her deposit to the movement
2020-06-18T00:00:00Z,Travel  Carnival to sell six cruise ships as bookings dry up
2020-06-19T04:00:00Z,Carnival to sell six cruise ships as bookings dry up
2020-06-30T00:00:00Z,overland track bookings season amid coronavirus limits
2020-06-30T00:00:00Z,Supreme Court allows Booking.com to trademark its name
2020-07-01T04:00:00Z,Drop in June airline bookings give reason for caution: IATA
2020-07-01T04:00:00Z,Strong bookings boost Ryanair's hopes of return to normal
2020-07-01T04:00:00Z,Ryanair sees 'very strong' July bookings but ticket prices lower than ever
2020-07-07T00:00:00Z,Airline bookings tumble as coronavirus cases spike
2020-07-07T04:00:00Z,"United Airlines warns of lower bookings, furloughs: source"
2020-07-07T04:00:00Z,"UK hotel bookings returning after Covid-19 slump, says Premier Inn owner"
2020-07-13T00:00:00Z,Southwest Airlines likely to cut jobs unless bookings 'triple'
2020-08-07T00:00:00Z,"1 'We've had 15,000 bookings for eat out to help out'"
2020-08-09T00:00:00Z,"2 'We've had 15,000 bookings for eat out to help out'"
2020-08-10T00:00:00Z,"5 'We've had 15,000 bookings for eat out to help out'"
2020-08-17T00:00:00Z,2 Ryanair cuts flights as EU virus rates hit bookings
2020-09-03T00:00:00Z,New rules on parties could block last-minute Airbnb bookings
2020-09-03T00:00:00Z,Labor Day weekend hotel bookings down 65% from 2019
2020-09-21T00:00:00Z,colac colac caravan park inundated with bookings
2020-09-27T00:00:00Z,Booking a train? Amtrak will now show you how full it is in real time.
2020-10-02T04:00:00Z,Airbnb blocks US Halloween bookings over party fears By James ClaytonNorth The USA expertise ... #world
2020-10-05T00:00:00Z,Airbnb is canceling one-night Halloween bookings to prevent house parties
2020-10-23T00:00:00Z,flight cancellations booking uncertainty plagues outback travel
2020-10-27T04:00:00Z,@TotesTravel : Holiday flight bookings not yet hurt by Covid case rise - JetBlue has not yet experienced a decline in demand for flights around the upcoming holidays despite increasing coronavirus cases... #TravelNewsInsights - https://t.co/wYzfkzXqr0
2020-11-03T00:00:00Z,tasmanian tourism bookings increase after border reopening
2020-11-08T00:00:00Z,Trump campaign is mocked for holding press conference in a parking lot between a sex shop and a crematorium in Philadelphia after 'mistakenly' booking Four Seasons Total Landscaping instead of luxury hotel
2020-11-12T00:00:00Z,qld border uncertainty scares off christmas tourism bookings
2020-11-12T00:00:00Z,Airbnb glitch cancels bookings
2020-11-20T00:00:00Z,Airlines see bookings drop as COVID-19 cases surge
2020-11-28T00:00:00Z,noosa takes bookings for $100000 a week property border reopen
2021-01-01T00:00:00Z,bookings cut short at the garden of eden caravan park nsw vic
2021-01-05T00:00:00Z,4 Firms cancel holiday bookings as lockdown begins
2021-01-13T00:00:00Z,Airbnb cancels DC bookings ahead of inauguration
2021-01-21T00:00:00Z,Mexico vacation bookings hit by new COVID test…
2021-01-27T00:00:00Z,3 Staycations: Bookings 'coming in thick and fast'
2021-02-10T00:00:00Z,demand for cruise bookings soars in wa despite covid legacy
2021-02-22T00:00:00Z,2 Holiday bookings surge on lockdown exit plans
2021-03-01T00:00:00Z,Booking your COVID-19 vaccination: Today's Toon
2021-03-01T00:00:00Z,"Ohio woman, 78, tries to register for a vaccine appointment and accidentally signs up for grocery delivery as senior citizens face series of confusing web pages when booking COVID shots"
2021-03-05T00:00:00Z,4 Pubs deluged with beer garden bookings
2021-03-06T00:00:00Z,Pubs deluged with beer garden bookings
2021-03-12T00:00:00Z,virgin australia bookings jump 40pc cheap airfares
2021-03-17T00:00:00Z,gps see a spike in bookings in next phase of
2021-03-17T00:00:00Z,phase 1b vaccinations open bookings
2021-03-18T00:00:00Z,health minister defends shambolic gp clinic vaccine bookings
2021-03-19T00:00:00Z,covid vaccine gp clinics pay bulk billed booking appointments
2021-03-20T00:00:00Z,covid 19 booking gps service frustrations
2021-03-25T00:00:00Z,More than 1 in 3 D.C. seniors aren’t booking vaccination appointments offered by city
2021-03-26T00:00:00Z,"Man, 47, admits starting 1987 school library fire when he was 12 and pleads guilty to murdering firefighter who died in the blaze after cold case detective recognized his booking photo"
2021-04-02T00:00:00Z,"Boy, 8, receives the COVID-19 vaccine in Texas after online booking system allowed his father to schedule an appointment without realizing children aren't eligible"
2021-04-28T04:00:00Z,Daily Crunch: Uber adds vaccine booking
2021-04-30T00:00:00Z,"Fed-up Oregon sheriff announces new jail booking criteria after months of riots, destruction"
2021-04-30T00:00:00Z,Oregon sheriff lowers jail booking criteria amid violent Portland protests
2021-05-13T00:00:00Z,4 Airbnb bookings jump as holiday demand soars
2021-05-15T00:00:00Z,Travelers are booking flights in record numbers
2021-05-18T00:00:00Z,Americans are booking working ‘vacci-cations’ ahead of office return
2021-05-19T04:00:00Z,Flaw in Japan Covid vaccine booking system causes disarray
2021-05-21T00:00:00Z,Americans are booking working ‘vacci-cations’ before office life resumes
2021-05-24T04:00:00Z,"Concert venue bookings are surging, Live Nation president says"
2021-05-29T00:00:00Z,Famed NYC restaurateur Keith McNally BANS ex-Vanity Fair editor Graydon Carter from his restaurants for a no-show booking unless he 'kisses my feet'
2021-07-08T00:00:00Z,1 Holiday bookings surge after quarantine relaxation
2021-07-14T04:00:00Z,"Moderna Booking Billions In Profits In Tax Havens, Report Says"
2021-07-22T00:00:00Z,State Dept. ends last-minute bookings for…
2021-08-06T04:00:00Z,This is grotesque... Kiwis abroad who are cancer patients are left to die. Families are stranded in Oz and across the world and are shut out by a failed MIQ booking system... but an American billionaire can come and go as he pleases on his private jet.
2021-08-26T00:00:00Z,"R Kelly fined workers for eating his donuts and docked another a week's pay for booking a male tour guide for singer and his girlfriends at Disney World, former employee testifies"
2021-09-24T00:00:00Z,Carnival posts $2 billion loss while seeing rise in late 2022 bookings
2021-10-30T00:00:00Z,We are past apologies for booking historically vulgar stars
2021-10-31T00:00:00Z,'Looks like I'm booking nothing but Southwest from now on!' Pilot divides Twitter over whether he should face punishment for saying anti-Joe Biden slogan 'Let's go Brandon' over intercom
2021-11-01T00:00:00Z,7:19 p.m.Travel booking and review sites changed for covid. Here’s how to use them.
2021-11-01T00:00:00Z,Travel booking and review sites changed for covid. Here’s how to use them.
2021-11-12T00:00:00Z,"Has there ever been such a hyped album launch as Adele's $50million Operation Overkill? From two Vogue covers to booking the planet's supply of vinyl, ALISON BOSHOFF says singer's return to the spotlight couldn't have been more exhaustive"
2021-11-30T00:00:00Z,3 EasyJet says Omicron has weakened bookings
2021-12-07T00:00:00Z,LiveThird Accuser Says Maxwell Facilitated Years of Abuse By EpsteinA woman identified as “Carolyn” said she was underage when Ghislaine Maxwell began booking her to give sexual massages to Jeffrey Epstein. Follow updates here.
2021-12-21T00:00:00Z,"6:22 p.m.How to cancel flights, hotels and other holiday bookings as omicron surges"
2021-12-23T00:00:00Z,"Kim Potter SMILES in new booking photo after being found GUILTY of first and second degree manslaughter for shooting dead Daunte Wright, 20, when she 'mistook her gun for her Taser' during traffic stop: Minnesota cop faces up to 25 years in prison"
2022-01-07T00:00:00Z,All 92 cruise ships sailing in the US have COVID cases onboard - but Americans are STILL booking trips: CDC probes liners for outbreaks among vaccinated passengers and crew
2022-01-13T00:00:00Z,3 French holiday bookings surge after rule change
2022-01-25T00:00:00Z,3 Holiday bookings jump as Covid travel tests axed
2022-01-29T00:00:00Z,"Table bookings in Manhattan restaurants are down 64% in January 2022 compared to pre-pandemic January 2020, according to new data."
2022-02-03T00:00:00Z,Wife trolls pitcher after 'booking our honeymoon too close to spring training'
2022-02-07T00:00:00Z,Saints' Alvin Kamara was arrested AT THE PRO BOWL a day after 'beating someone at a Las Vegas nightclub': Cops waited for NFL star to finish playing before questioning him and booking him on felony battery charge
2022-03-04T00:00:00Z,Here's why hundreds of people are booking Airbnb rentals in Ukraine
2022-03-04T00:00:00Z,People around the world are booking Airbnbs to…
2022-03-15T00:00:00Z,Airlines are seeing a surge in bookings. That's bad news…
2022-03-15T00:00:00Z,Airlines are seeing a surge in bookings. That's…
2022-03-21T00:00:00Z,Montana airport calls police on Ted Cruz after he missed check-in window for his flight and grew angry when he was told re-booking options were limited due to Spring Break
2022-04-16T00:00:00Z,"WASTE INN: ICE blew millions booking unused hotels for migrants, says DHS watchdog"
2022-06-12T00:00:00Z,3 Hajj pilgrims face losing out from online booking
2022-06-16T00:00:00Z,Brooklyn venue cancels concert by would-be assassin who tried to shoot Ronald Reagan dead in 1981 after receiving threats over the booking
2022-06-29T00:00:00Z,"More than 500 flights across the US are canceled today as pilots blame 'staff shortage' on covid vaccine mandate - and with messy Fourth of July weekend expected, Delta is already offering customers free rebooking"
2022-07-02T00:00:00Z,British Airways apologizes after its website stopped female doctor booking flights because her 'title and gender do not match'
2022-07-02T00:00:00Z,Venice will charge tourists €10 to visit the city in world first as officials set up online booking system to combat overcrowding
2022-07-12T00:00:00Z,County prison in Seattle shuts down booking for entire night due to staffing shortages
2022-08-02T00:00:00Z,1 Airbnb bookings hit record high as travel recovers
2022-08-23T00:00:00Z,Cruise bookings are up as COVID rules drop…
2022-08-31T00:00:00Z,Cruise bookings are up as COVID rules drop: What…
2022-09-09T00:00:00Z,Holiday Inn bookings tank after suspected ransomware attack: franchisees
2022-10-21T00:00:00Z,'Be aware of the small print' for flights on third-party booking sites
2022-10-25T00:00:00Z,Booking tips to help you save on your holiday…
2022-10-28T00:00:00Z,Boots with the fur! Wendy Williams is spotted out on a trip to NYC Costco - two months after booking herself into rehab to 'focus on health and wellness'
2022-11-07T00:00:00Z,'A slap in the face': 'SNL' slammed for booking Dave Chappelle to host
2022-11-29T00:00:00Z,2 EasyJet bookings up despite cost-of-living crisis
2022-12-06T00:00:00Z,Read the Where To Eat NewsletterHave a glamorous meal without booking a room at these hotel lobby restaurants.4 min read
2022-12-11T21:30:00Z,"The travel site '""The Points Guy'"" releases its favorite reward programshttps://firebasestorage.googleapis.com/v0/b/hackernoon-app.appspot.com/o/images%2Fimageedit_25_7084755369.gif?alt=media&token=ca7527b0-a214-46d4-af72-1062b3df1458whether you''re looking for *** flight or booking *** room brian kelly and Nikki kelvin from the points Guy Tell cbs morning''s Some brands have better loyalty programs than others among airlines."
2022-12-28T08:17:00Z,Christmas Snowflakes Metal Cutting Dies Stencil Diy Scrapbooking Album Paper Card Template Mold Embossing Craft Decoration
2022-12-30T00:00:00Z,"What to know about Southwest refunds, rebooking and lost luggage"
2022-12-30T10:14:00Z,"This only shows how Shah Rukh Khan''s comeback will break all the myth s of '""Bollywood is over!'""https://firebasestorage.googleapis.com/v0/b/hackernoon-app.appspot.com/o/images%2Fimageedit_25_7084755369.gif?alt=media&token=ca7527b0-a214-46d4-af72-1062b3df1458Pathaan Box Office (Advance Booking – Germany): Shah Rukh Khan – The King Of Overseas Is Already Breaking Records 27 Days Before The Release ( Photo Credit – Instagram; Twitter ) “Mughal-e ...\nw5dcygvlet8sx0d5pk925lyertu7d02023-01-04 23:00:00https://finance.yahoo.com/news/advance-auto-parts-aap-gains-230011799.htmlAdvance Auto Parts (AAP) Gains But Lags Market: What You Should Knowhttps://firebasestorage.googleapis.com/v0/b/hackernoon-app.appspot.com/o/images%2Fimageedit_25_7084755369.gif?alt=media&token=ca7527b0-a214-46d4-af72-1062b3df1458""Advance Auto Parts (AAP) closed at $151.89 in the latest trading session marking a +0.23% move from the prior day."
2023-01-04T04:29:00Z,Round Flower Leaf Metal Cutting Dies Stencil Scrapbooking Diy Album Stamp Paper
2023-02-06T09:24:00Z,"'""Never Worry About Your Luggage Again with LugBee''s Luggage Storage Solution!'""https://firebasestorage.googleapis.com/v0/b/hackernoon-app.appspot.com/o/images%2Fimageedit_25_7084755369.gif?alt=media&token=ca7527b0-a214-46d4-af72-1062b3df1458""Founded by Jitender Singh LugBee is here to simplify your life with a simple and secure online store booking system for luggage storage."
2023-02-06T12:19:00Z,Samsung Galaxy S23 Series Pre-Booking in India: 1.4L units in 24 hrs
2023-02-06T12:54:00Z,Samsung Galaxy S23 Series Log 1.4 Lakh Pre-Bookings Worth Rs 1400 Cr For In 24 Hrs In India
2023-02-06T14:00:00Z,"NEW BOOKING.COM AD CAMPAIGN WITH ACTRESS & PRODUCER MELISSA MCCARTHY AIMS TO INSPIRE TRAVELERS TO BOOK '""SOMEWHERE ANYWHERE'""https://firebasestorage.googleapis.com/v0/b/hackernoon-app.appspot.com/o/images%2Fimageedit_25_7084755369.gif?alt=media&token=ca7527b0-a214-46d4-af72-1062b3df1458""Airing live for the first time during the '""big game'"" on February 12 Booking.com will give away half a million dollars in travel credits with 50 lucky winners receiving $10000 each NEW YORK Feb. 6"
2023-02-16T04:23:15Z,Bookings to Japan and Bali are expected to soar. What the latest data tells us about where Australians are travelling to
2023-02-17T12:17:00Z,Star Chef Recalls Bill Gates' Bizarre Order After Booking Entire Restaurant
2023-02-22T00:36:00Z,France B2C Ecommerce Market Report 2023-2027 Featuring Amazon eBay Booking.com Omio Tripadvisor Deliveroo HelloFresh Uber Eats Among Others
2023-02-23T23:43:00Z,Zacks Market Edge Highlights: Microsoft Alphabet Airbnb Expedia Group and Booking Holdings
2023-03-03T08:59:00Z,Travel Digitalization Market Likely to Enjoy Remarkable Growth with Trivago Booking Holdings Skyscanner Google
2023-03-03T08:59:00Z,Online Bookings and Travel Planning Service Market Likely to Enjoy Remarkable Growth with Trivago Booking Holdings Skyscanner Google
2023-03-03T09:01:00Z,Digitalization of the Travel Industry Market SWOT Analysis by Leading Key Players Trivago Booking Holdings Skyscanner Google
2023-03-06T18:03:00Z,Travelsoft Acquires Travel Compositor to Expand Booking Software Services
2023-03-16T09:38:00Z,"Posts tagged '""svb collapse'""https://firebasestorage.googleapis.com/v0/b/hackernoon-app.appspot.com/o/images%2Fimageedit_25_7084755369.gif?alt=media&token=ca7527b0-a214-46d4-af72-1062b3df1458Aussie fintech Airwallex spun up a lot of new accounts in the wake of SVB. But it says that helping people was its focus. You'll also receive messages on behalf of our partners. You can opt-out at any time. SmartCompany is the leading online publication in ...\nnnn3do64f39qn7q8pocb48np1hj9aa2023-03-11 11:59:00https://manometcurrent.com/airwallex-secures-200m-series-funding-at-4b-valuation/Airwallex secures $200m series funding at $4b valuationhttps://www.bing.com/th?id=OVFT.G9bXGgWM9865_Dh8hFGR_S&pid=News""Airwallex the global travel company that offers a range of online and mobile services for booking flights and hotels has secured"
2023-03-23T11:05:00Z,The Zacks Analyst Blog Highlights Amazon.com Novo Nordisk Qualcomm Booking Holdings and Chubb
2023-03-24T16:57:00Z,Tigress Financial Remains a Buy on Booking Holdings (BKNG)
2023-03-30T08:20:00Z,Booking.com’s Chris Dell on Localizing the World’s Largest Travel Platform
2023-04-03T19:32:00Z,"New project '""HYSTERIA'"" with Peacock Networkhttps://firebasestorage.googleapis.com/v0/b/hackernoon-app.appspot.com/o/images%2Fimageedit_25_7084755369.gif?alt=media&token=ca7527b0-a214-46d4-af72-1062b3df1458Sub Request Casting TaylorMade (Casting™) is beginning to cast for our new project '""HYSTERIA'"" with Peacock Network. This show is set in the 1980s! We are looking forward to get this booking ..."
2023-04-04T17:18:00Z,Google to pay money to customers if flight ticket prices drop after booking. Details
2023-04-08T11:49:00Z,Routes: Google Flights to reimburse users if fares change after booking. Here's how.
2023-04-19T04:35:00Z,"Posts tagged '""Amelia Hamer Airwallex'""https://firebasestorage.googleapis.com/v0/b/hackernoon-app.appspot.com/o/images%2Fimageedit_25_7084755369.gif?alt=media&token=ca7527b0-a214-46d4-af72-1062b3df1458Read more of SmartCompany's coverage of Amelia Hamer Airwallex.\nmothcly3ni9o8578pocb48np1hj9aa2023-04-28 00:34:00https://www.retailbiz.com.au/online-retailing/nsw-qld-and-tas-lead-the-battle-for-online-sales/""NSW QLD and TAS lead the battle for online saleshttps://www.bing.com/th?id=OVFT.WUNchwGqsMpVgX0tGGYJlC&pid=NewsThe Index shows Australians have spent $124.1 million less online than a. year ago as people buy fewer clothes and products through e-commerce and redirect some of their spending into booking travel and education courses."
2023-05-02T13:00:00Z,CharterUp bus-booking platform moves HQ to Austin plans to add 100 jobs
2023-05-03T14:00:00Z,Etihad to Make Flight Bookings Conversational Using Artificial Intelligence
2023-05-04T18:54:00Z,Vacation rental software company launches ChatGPT-powered AI tool to increase bookings
2023-05-08T01:19:00Z,More speakers announced for Maximum Occupancy: Google TripAdvisor Booking.com
2023-05-18T18:12:00Z,A.I. travel booking services could compromise Google''s revenue says Redburn''s Alex Brignall
2023-05-22T19:56:00Z,Salesforce''s Quarterly Bookings Growth Seen ''Moderating'' Amid Business Environment Woes Oppenheimer Says
2023-06-01T20:15:00Z,Apple And John Lewis Lead Retail Rankings For Value Added Services BookingBug Study Shows
2023-06-07T20:39:00Z,Booking Holdings (BKNG) Ups Generative AI Game With Google
2023-06-14T18:52:00Z,Google and Booking Face European Objections Over Competition
2023-06-21T04:41:00Z,"Unlimited'' pto is just a scam so companies don’t have to pay out accrued pto when people leave.'""https://firebasestorage.googleapis.com/v0/b/hackernoon-app.appspot.com/o/images%2Fimageedit_25_7084755369.gif?alt=media&token=ca7527b0-a214-46d4-af72-1062b3df1458A corporate worker who posts on TikTok under the handle Cuddles (@cuddleswpuddles) posted a video discussing how companies that offer unlimited PTO aren’t being truthful to their employees.\ntqfbhr0tjzhwfj81j63nvdb5ubo4tr2023-06-12 00:00:00https://money.usnews.com/credit-cards/chase/chase-freedom-unlimitedChase Freedom Unlimited®https://firebasestorage.googleapis.com/v0/b/hackernoon-app.appspot.com/o/images%2Fimageedit_25_7084755369.gif?alt=media&token=ca7527b0-a214-46d4-af72-1062b3df1458""Earn unlimited 5% cash back on travel bookings through the Chase Ultimate Rewards portal 3% back on dining and drugstore purchases and 1.5% back on all other purchases. New cardholders receive ..."
2023-06-27T16:00:00Z,Booking.com Chooses OpenAI — Not Google Bard —for Generative AI Rollout
2023-06-27T16:00:00Z,Booking.com Chooses OpenAI – Not Google Bard – for Generative AI Rollout
2023-06-28T14:10:00Z,Priceline Unveils Trip Intelligence its Summer 2023 Product Release A Game-Changing Suite of Tools and Enhancements for Smarter Travel Booking
2023-06-29T17:45:00Z,Booking.com: Bald planen Sie Reisen mit künstlicher Intelligenz
2023-07-04T11:47:00Z,Booking Holdings (BKNG) Boosts Offerings With Trip Intelligence
2023-07-07T06:00:00Z,Google Travel and Booking.com Poised for Fallout From European Union’s ‘Gatekeeper’ Restrictions
2023-07-07T06:00:00Z,Google and Booking.com Poised for Fallout From EU’s ‘Gatekeeper’ Restrictions
2023-07-13T15:49:00Z,"Online Travel Update: Expedia Group launches One Key Booking.com potentially impacted by EU '""Gatekeeper'"" Designationhttps://firebasestorage.googleapis.com/v0/b/hackernoon-app.appspot.com/o/images%2Fimageedit_25_7084755369.gif?alt=media&token=ca7527b0-a214-46d4-af72-1062b3df1458But the fact that Booking Holdings filed a statement from Booking.com with the U.S. Securities and Exchange Commission about it this week means it believes the repercussions could be material to its operations."
2023-07-17T00:00:00Z,Airline Booking Platforms Market May See a Big Move | Alphabet Booking Holdings Trip.com
2023-08-04T11:57:00Z,Apple Amazon Booking Atlassian DraftKings Fortinet and More Stock Market Movers
2023-08-04T12:43:00Z,These Stocks Are Moving the Most Today: Apple Amazon Booking Atlassian DraftKings Opendoor and More
2023-08-04T14:15:00Z,Apple Amazon Atlassian Fortinet Booking and More Stock Market Movers
2023-08-04T20:08:00Z,Amazon Booking Holdings rise; Apple Monster Beverage fall Friday...
2023-08-05T05:24:00Z,Booking Holdings rise; Apple Monster Beverage fall
2023-08-10T13:04:00Z,Samsung Galaxy Z Flip 5 And Z Fold 5 Secures 100000 Pre-Bookings In India Within Just 28 Hours
2023-08-16T03:53:00Z,"'""Booking Holdings Delivers Strong Q2 2023 Results Despite Macroeconomic Uncertainty'""https://firebasestorage.googleapis.com/v0/b/hackernoon-app.appspot.com/o/images%2Fimageedit_25_7084755369.gif?alt=media&token=ca7527b0-a214-46d4-af72-1062b3df1458Let’s analyze the key drivers behind Booking Holdings’ financial performance in Q2 2023 and assess the company’s growth outlook. Robust Travel Demand Powers Revenue Growth Booking Holdings ...\nigm3s1ks7uxj2a0emkt5rbztwmva212023-03-08 20:02:00https://seekingalpha.com/article/4585721-booking-holdings-massive-share-buybacks-inboundBooking Holdings: Massive Share Buybacks Inboundhttps://www.bing.com/th?id=OVFT.2K6BbDBhdzJKczObxIcBzy&pid=News""Booking Holdings delivered excellent financial results for both 4Q22 and FY22 and BKNG looks like it is back to growth mode. Click here for my review of BKNG."
